[
  {
    "date": "2014-07-15",
    "distance": 17260.0,
    "elevation_gain": 93.0,
    "id": "166361465",
    "moving_time": 2810.0,
    "name": "Evening Ride",
    "raw_activity_type": "Ride",
    "raw_type": "Ride",
    "start_date_local": "2014-07-15T19:26:14Z",
    "type": "Ride",
    "year": 2014
  },
  {
    "date": "2014-07-16",
    "distance": 8806.3,
    "elevation_gain": 27.7,
    "id": "166790365",
    "moving_time": 1454.0,
    "name": "Evening Ride",
    "raw_activity_type": "Ride",
    "raw_type": "Ride",
    "start_date_local": "2014-07-16T18:22:44Z",
    "type": "Ride",
    "year": 2014
  },
  {
    "date": "2014-07-17",
    "distance": 28382.0,
    "elevation_gain": 126.1,
    "id": "167207495",
    "moving_time": 4590.0,
    "name": "Afternoon Ride",
    "raw_activity_type": "Ride",
    "raw_type": "Ride",
    "start_date_local": "2014-07-17T17:06:43Z",
    "type": "Ride",
    "year": 2014
  },
  {
    "date": "2014-07-20",
    "distance": 19992.0,
    "elevation_gain": 162.2,
    "id": "168624243",
    "moving_time": 3338.0,
    "name": "Evening Ride",
    "raw_activity_type": "Ride",
    "raw_type": "Ride",
    "start_date_local": "2014-07-20T20:25:46Z",
    "type": "Ride",
    "year": 2014
  },
  {
    "date": "2014-07-21",
    "distance": 16613.4,
    "elevation_gain": 91.1,
    "id": "169015401",
    "moving_time": 2548.0,
    "name": "Evening Ride",
    "raw_activity_type": "Ride",
    "raw_type": "Ride",
    "start_date_local": "2014-07-21T19:13:36Z",
    "type": "Ride",
    "year": 2014
  },
  {
    "date": "2014-07-22",
    "distance": 47707.2,
    "elevation_gain": 471.5,
    "id": "169375903",
    "moving_time": 7816.0,
    "name": "Afternoon Ride",
    "raw_activity_type": "Ride",
    "raw_type": "Ride",
    "start_date_local": "2014-07-22T14:10:37Z",
    "type": "Ride",
    "year": 2014
  },
  {
    "date": "2014-07-25",
    "distance": 27522.8,
    "elevation_gain": 402.7,
    "id": "170702489",
    "moving_time": 5420.0,
    "name": "Lunch Ride",
    "raw_activity_type": "Ride",
    "raw_type": "Ride",
    "start_date_local": "2014-07-25T12:29:49Z",
    "type": "Ride",
    "year": 2014
  },
  {
    "date": "2014-07-28",
    "distance": 28096.5,
    "elevation_gain": 135.3,
    "id": "172060238",
    "moving_time": 4374.0,
    "name": "Afternoon Ride",
    "raw_activity_type": "Ride",
    "raw_type": "Ride",
    "start_date_local": "2014-07-28T13:20:21Z",
    "type": "Ride",
    "year": 2014
  },
  {
    "date": "2014-07-28",
    "distance": 36173.6,
    "elevation_gain": 251.0,
    "id": "172229492",
    "moving_time": 6778.0,
    "name": "Evening Ride",
    "raw_activity_type": "Ride",
    "raw_type": "Ride",
    "start_date_local": "2014-07-28T19:05:31Z",
    "type": "Ride",
    "year": 2014
  },
  {
    "date": "2014-07-30",
    "distance": 28424.0,
    "elevation_gain": 144.6,
    "id": "173065484",
    "moving_time": 5044.0,
    "name": "Afternoon Ride",
    "raw_activity_type": "Ride",
    "raw_type": "Ride",
    "start_date_local": "2014-07-30T16:19:02Z",
    "type": "Ride",
    "year": 2014
  },
  {
    "date": "2014-08-01",
    "distance": 34548.1,
    "elevation_gain": 301.2,
    "id": "173915999",
    "moving_time": 5375.0,
    "name": "Afternoon Ride",
    "raw_activity_type": "Ride",
    "raw_type": "Ride",
    "start_date_local": "2014-08-01T13:24:43Z",
    "type": "Ride",
    "year": 2014
  },
  {
    "date": "2014-08-01",
    "distance": 17011.1,
    "elevation_gain": 93.6,
    "id": "174066647",
    "moving_time": 3555.0,
    "name": "Evening Ride",
    "raw_activity_type": "Ride",
    "raw_type": "Ride",
    "start_date_local": "2014-08-01T20:43:32Z",
    "type": "Ride",
    "year": 2014
  },
  {
    "date": "2014-08-04",
    "distance": 28779.0,
    "elevation_gain": 283.5,
    "id": "175318431",
    "moving_time": 4562.0,
    "name": "Afternoon Ride",
    "raw_activity_type": "Ride",
    "raw_type": "Ride",
    "start_date_local": "2014-08-04T15:13:49Z",
    "type": "Ride",
    "year": 2014
  },
  {
    "date": "2014-08-06",
    "distance": 16249.2,
    "elevation_gain": 87.9,
    "id": "176327434",
    "moving_time": 2608.0,
    "name": "Afternoon Ride",
    "raw_activity_type": "Ride",
    "raw_type": "Ride",
    "start_date_local": "2014-08-06T15:28:29Z",
    "type": "Ride",
    "year": 2014
  },
  {
    "date": "2014-08-07",
    "distance": 71826.8,
    "elevation_gain": 246.6,
    "id": "176877077",
    "moving_time": 12099.0,
    "name": "Lost in Livingston",
    "raw_activity_type": "Ride",
    "raw_type": "Ride",
    "start_date_local": "2014-08-07T14:39:08Z",
    "type": "Ride",
    "year": 2014
  },
  {
    "date": "2014-08-12",
    "distance": 11752.5,
    "elevation_gain": 81.6,
    "id": "179259120",
    "moving_time": 1859.0,
    "name": "Shite",
    "raw_activity_type": "Ride",
    "raw_type": "Ride",
    "start_date_local": "2014-08-12T18:20:22Z",
    "type": "Ride",
    "year": 2014
  },
  {
    "date": "2014-08-15",
    "distance": 21341.0,
    "elevation_gain": 138.3,
    "id": "180553274",
    "moving_time": 3411.0,
    "name": "Afternoon Ride",
    "raw_activity_type": "Ride",
    "raw_type": "Ride",
    "start_date_local": "2014-08-15T15:17:20Z",
    "type": "Ride",
    "year": 2014
  },
  {
    "date": "2014-08-18",
    "distance": 30627.6,
    "elevation_gain": 175.5,
    "id": "181928173",
    "moving_time": 4160.0,
    "name": "Afternoon Ride",
    "raw_activity_type": "Ride",
    "raw_type": "Ride",
    "start_date_local": "2014-08-18T14:22:28Z",
    "type": "Ride",
    "year": 2014
  },
  {
    "date": "2014-08-21",
    "distance": 33389.7,
    "elevation_gain": 324.9,
    "id": "183344288",
    "moving_time": 5401.0,
    "name": "Getting lost again",
    "raw_activity_type": "Ride",
    "raw_type": "Ride",
    "start_date_local": "2014-08-21T13:43:56Z",
    "type": "Ride",
    "year": 2014
  },
  {
    "date": "2014-08-22",
    "distance": 16736.3,
    "elevation_gain": 97.2,
    "id": "183791340",
    "moving_time": 3119.0,
    "name": "Afternoon Ride",
    "raw_activity_type": "Ride",
    "raw_type": "Ride",
    "start_date_local": "2014-08-22T15:26:39Z",
    "type": "Ride",
    "year": 2014
  },
  {
    "date": "2014-08-24",
    "distance": 30725.7,
    "elevation_gain": 225.3,
    "id": "184688620",
    "moving_time": 4575.0,
    "name": "Afternoon Ride",
    "raw_activity_type": "Ride",
    "raw_type": "Ride",
    "start_date_local": "2014-08-24T13:33:44Z",
    "type": "Ride",
    "year": 2014
  },
  {
    "date": "2014-08-25",
    "distance": 15870.3,
    "elevation_gain": 114.1,
    "id": "185183797",
    "moving_time": 2154.0,
    "name": "Forgot to start it...",
    "raw_activity_type": "Ride",
    "raw_type": "Ride",
    "start_date_local": "2014-08-25T15:09:46Z",
    "type": "Ride",
    "year": 2014
  },
  {
    "date": "2014-08-26",
    "distance": 32787.7,
    "elevation_gain": 310.2,
    "id": "185563622",
    "moving_time": 5057.0,
    "name": "Afternoon Ride",
    "raw_activity_type": "Ride",
    "raw_type": "Ride",
    "start_date_local": "2014-08-26T14:36:09Z",
    "type": "Ride",
    "year": 2014
  },
  {
    "date": "2014-08-28",
    "distance": 32289.5,
    "elevation_gain": 96.4,
    "id": "186535667",
    "moving_time": 4882.0,
    "name": "Afternoon Ride",
    "raw_activity_type": "Ride",
    "raw_type": "Ride",
    "start_date_local": "2014-08-28T15:47:47Z",
    "type": "Ride",
    "year": 2014
  },
  {
    "date": "2014-09-01",
    "distance": 17840.8,
    "elevation_gain": 96.8,
    "id": "188335698",
    "moving_time": 2687.0,
    "name": "Afternoon Ride",
    "raw_activity_type": "Ride",
    "raw_type": "Ride",
    "start_date_local": "2014-09-01T15:13:14Z",
    "type": "Ride",
    "year": 2014
  },
  {
    "date": "2014-09-08",
    "distance": 31152.0,
    "elevation_gain": 220.9,
    "id": "191660771",
    "moving_time": 4289.0,
    "name": "Afternoon Ride",
    "raw_activity_type": "Ride",
    "raw_type": "Ride",
    "start_date_local": "2014-09-08T14:18:44Z",
    "type": "Ride",
    "year": 2014
  },
  {
    "date": "2014-09-12",
    "distance": 13498.6,
    "elevation_gain": 88.6,
    "id": "193482042",
    "moving_time": 1938.0,
    "name": "Afternoon Ride",
    "raw_activity_type": "Ride",
    "raw_type": "Ride",
    "start_date_local": "2014-09-12T16:24:24Z",
    "type": "Ride",
    "year": 2014
  },
  {
    "date": "2014-09-15",
    "distance": 38384.6,
    "elevation_gain": 432.8,
    "id": "194888035",
    "moving_time": 5770.0,
    "name": "Afternoon Ride",
    "raw_activity_type": "Ride",
    "raw_type": "Ride",
    "start_date_local": "2014-09-15T14:02:33Z",
    "type": "Ride",
    "year": 2014
  },
  {
    "date": "2014-09-19",
    "distance": 10862.3,
    "elevation_gain": 73.3,
    "id": "196640007",
    "moving_time": 1995.0,
    "name": "Puncture :(",
    "raw_activity_type": "Ride",
    "raw_type": "Ride",
    "start_date_local": "2014-09-19T16:24:23Z",
    "type": "Ride",
    "year": 2014
  },
  {
    "date": "2014-09-23",
    "distance": 15915.2,
    "elevation_gain": 230.5,
    "id": "198424866",
    "moving_time": 2511.0,
    "name": "Back on it",
    "raw_activity_type": "Ride",
    "raw_type": "Ride",
    "start_date_local": "2014-09-23T15:49:00Z",
    "type": "Ride",
    "year": 2014
  },
  {
    "date": "2014-09-26",
    "distance": 30191.6,
    "elevation_gain": 298.6,
    "id": "199627216",
    "moving_time": 4971.0,
    "name": "Windy ride",
    "raw_activity_type": "Ride",
    "raw_type": "Ride",
    "start_date_local": "2014-09-26T13:18:38Z",
    "type": "Ride",
    "year": 2014
  },
  {
    "date": "2014-09-29",
    "distance": 42273.0,
    "elevation_gain": 329.4,
    "id": "201016926",
    "moving_time": 6029.0,
    "name": "Get smashed",
    "raw_activity_type": "Ride",
    "raw_type": "Ride",
    "start_date_local": "2014-09-29T12:27:29Z",
    "type": "Ride",
    "year": 2014
  },
  {
    "date": "2014-10-01",
    "distance": 80415.9,
    "elevation_gain": 439.8,
    "id": "201893889",
    "moving_time": 13289.0,
    "name": "Loch Lomond!",
    "raw_activity_type": "Ride",
    "raw_type": "Ride",
    "start_date_local": "2014-10-01T11:43:32Z",
    "type": "Ride",
    "year": 2014
  },
  {
    "date": "2014-10-06",
    "distance": 19421.9,
    "elevation_gain": 92.3,
    "id": "204037587",
    "moving_time": 2941.0,
    "name": "Recovery ride",
    "raw_activity_type": "Ride",
    "raw_type": "Ride",
    "start_date_local": "2014-10-06T14:21:07Z",
    "type": "Ride",
    "year": 2014
  },
  {
    "date": "2014-10-08",
    "distance": 24137.8,
    "elevation_gain": 204.7,
    "id": "204774716",
    "moving_time": 3817.0,
    "name": "So cold",
    "raw_activity_type": "Ride",
    "raw_type": "Ride",
    "start_date_local": "2014-10-08T11:18:53Z",
    "type": "Ride",
    "year": 2014
  },
  {
    "date": "2014-10-10",
    "distance": 35441.7,
    "elevation_gain": 321.1,
    "id": "205591291",
    "moving_time": 5347.0,
    "name": "Afternoon Ride",
    "raw_activity_type": "Ride",
    "raw_type": "Ride",
    "start_date_local": "2014-10-10T13:50:56Z",
    "type": "Ride",
    "year": 2014
  },
  {
    "date": "2014-10-16",
    "distance": 27918.4,
    "elevation_gain": 129.3,
    "id": "207995990",
    "moving_time": 3980.0,
    "name": "Afternoon Ride",
    "raw_activity_type": "Ride",
    "raw_type": "Ride",
    "start_date_local": "2014-10-16T14:52:08Z",
    "type": "Ride",
    "year": 2014
  },
  {
    "date": "2014-10-25",
    "distance": 38698.4,
    "elevation_gain": 476.6,
    "id": "211428517",
    "moving_time": 6833.0,
    "name": "Cairngorms! Windy as balls",
    "raw_activity_type": "Ride",
    "raw_type": "Ride",
    "start_date_local": "2014-10-25T12:49:12Z",
    "type": "Ride",
    "year": 2014
  },
  {
    "date": "2014-10-29",
    "distance": 24481.9,
    "elevation_gain": 251.4,
    "id": "213114670",
    "moving_time": 3874.0,
    "name": "Lunch Ride",
    "raw_activity_type": "Ride",
    "raw_type": "Ride",
    "start_date_local": "2014-10-29T12:47:06Z",
    "type": "Ride",
    "year": 2014
  },
  {
    "date": "2014-10-31",
    "distance": 30466.2,
    "elevation_gain": 179.6,
    "id": "213891909",
    "moving_time": 5010.0,
    "name": "Afternoon ride",
    "raw_activity_type": "Ride",
    "raw_type": "Ride",
    "start_date_local": "2014-10-31T13:51:28Z",
    "type": "Ride",
    "year": 2014
  },
  {
    "date": "2014-11-03",
    "distance": 6738.9,
    "elevation_gain": 50.5,
    "id": "215179394",
    "moving_time": 2166.0,
    "name": "Running like a pleb",
    "raw_activity_type": "Run",
    "raw_type": "Run",
    "start_date_local": "2014-11-03T19:38:38Z",
    "type": "Run",
    "year": 2014
  },
  {
    "date": "2014-11-10",
    "distance": 6609.4,
    "elevation_gain": 51.8,
    "id": "217855391",
    "moving_time": 2277.0,
    "name": "Evening Run",
    "raw_activity_type": "Run",
    "raw_type": "Run",
    "start_date_local": "2014-11-10T20:09:20Z",
    "type": "Run",
    "year": 2014
  },
  {
    "date": "2014-12-02",
    "distance": 30980.6,
    "elevation_gain": 215.4,
    "id": "225519867",
    "moving_time": 4754.0,
    "name": "Kilmacolm. It's so cold!",
    "raw_activity_type": "Ride",
    "raw_type": "Ride",
    "start_date_local": "2014-12-02T14:24:51Z",
    "type": "Ride",
    "year": 2014
  },
  {
    "date": "2014-12-10",
    "distance": 4547.2,
    "elevation_gain": 51.0,
    "id": "228185719",
    "moving_time": 1483.0,
    "name": "Cold & windy",
    "raw_activity_type": "Run",
    "raw_type": "Run",
    "start_date_local": "2014-12-10T19:48:06Z",
    "type": "Run",
    "year": 2014
  },
  {
    "date": "2014-12-15",
    "distance": 21964.5,
    "elevation_gain": 209.3,
    "id": "229651969",
    "moving_time": 3590.0,
    "name": "Cold bowfield",
    "raw_activity_type": "Ride",
    "raw_type": "Ride",
    "start_date_local": "2014-12-15T12:32:20Z",
    "type": "Ride",
    "year": 2014
  },
  {
    "date": "2014-12-19",
    "distance": 5924.8,
    "elevation_gain": 49.9,
    "id": "230815612",
    "moving_time": 1927.0,
    "name": "Afternoon Run",
    "raw_activity_type": "Run",
    "raw_type": "Run",
    "start_date_local": "2014-12-19T15:04:23Z",
    "type": "Run",
    "year": 2014
  },
  {
    "date": "2014-12-29",
    "distance": 16210.6,
    "elevation_gain": 117.0,
    "id": "234144213",
    "moving_time": 2470.0,
    "name": "12/29/2014 Kilbarchan, Scotland, United Kingdom",
    "raw_activity_type": "Ride",
    "raw_type": "Ride",
    "start_date_local": "2014-12-29T13:11:12Z",
    "type": "Ride",
    "year": 2014
  },
  {
    "date": "2014-12-30",
    "distance": 29900.9,
    "elevation_gain": 203.0,
    "id": "234523354",
    "moving_time": 4364.0,
    "name": "12/30/2014 Kilbarchan, Scotland, United Kingdom",
    "raw_activity_type": "Ride",
    "raw_type": "Ride",
    "start_date_local": "2014-12-30T12:31:09Z",
    "type": "Ride",
    "year": 2014
  },
  {
    "date": "2015-01-03",
    "distance": 29967.2,
    "elevation_gain": 141.0,
    "id": "236020271",
    "moving_time": 4408.0,
    "name": "01/03/2015 Kilbarchan, Scotland, United Kingdom",
    "raw_activity_type": "Ride",
    "raw_type": "Ride",
    "start_date_local": "2015-01-03T09:21:21Z",
    "type": "Ride",
    "year": 2015
  },
  {
    "date": "2015-01-05",
    "distance": 20190.5,
    "elevation_gain": 104.0,
    "id": "237082475",
    "moving_time": 2897.0,
    "name": "01/05/2015 Kilbarchan, Scotland, United Kingdom",
    "raw_activity_type": "Ride",
    "raw_type": "Ride",
    "start_date_local": "2015-01-05T14:02:58Z",
    "type": "Ride",
    "year": 2015
  },
  {
    "date": "2015-01-08",
    "distance": 50012.3,
    "elevation_gain": 491.0,
    "id": "238385312",
    "moving_time": 7548.0,
    "name": "01/08/2015 Kilbarchan, Scotland, United Kingdom",
    "raw_activity_type": "Ride",
    "raw_type": "Ride",
    "start_date_local": "2015-01-08T13:33:20Z",
    "type": "Ride",
    "year": 2015
  },
  {
    "date": "2015-01-11",
    "distance": 14862.8,
    "elevation_gain": 0.0,
    "id": "240233767",
    "moving_time": 1938.0,
    "name": "01/11/2015 United Kingdom",
    "raw_activity_type": "Ride",
    "raw_type": "Ride",
    "start_date_local": "2015-01-11T21:01:26Z",
    "type": "Ride",
    "year": 2015
  },
  {
    "date": "2015-01-22",
    "distance": 7106.6,
    "elevation_gain": 119.0,
    "id": "270811424",
    "moving_time": 1249.0,
    "name": "01/22/2015 Kilbarchan, Scotland, United Kingdom",
    "raw_activity_type": "Ride",
    "raw_type": "Ride",
    "start_date_local": "2015-01-22T15:30:39Z",
    "type": "Ride",
    "year": 2015
  },
  {
    "date": "2015-02-18",
    "distance": 6458.4,
    "elevation_gain": 64.2,
    "id": "256739575",
    "moving_time": 2075.0,
    "name": "Evening Run",
    "raw_activity_type": "Run",
    "raw_type": "Run",
    "start_date_local": "2015-02-18T18:28:08Z",
    "type": "Run",
    "year": 2015
  },
  {
    "date": "2015-02-24",
    "distance": 5312.3,
    "elevation_gain": 51.2,
    "id": "259434300",
    "moving_time": 1419.0,
    "name": "David Run",
    "raw_activity_type": "Run",
    "raw_type": "Run",
    "start_date_local": "2015-02-24T21:25:42Z",
    "type": "Run",
    "year": 2015
  },
  {
    "date": "2015-03-10",
    "distance": 20797.0,
    "elevation_gain": 95.3,
    "id": "265927189",
    "moving_time": 3195.0,
    "name": "Windy day",
    "raw_activity_type": "Ride",
    "raw_type": "Ride",
    "start_date_local": "2015-03-10T12:43:16Z",
    "type": "Ride",
    "year": 2015
  },
  {
    "date": "2015-03-10",
    "distance": 19499.5,
    "elevation_gain": 115.0,
    "id": "270811429",
    "moving_time": 3084.0,
    "name": "03/10/2015 Kilbarchan, Scotland, United Kingdom",
    "raw_activity_type": "Ride",
    "raw_type": "Ride",
    "start_date_local": "2015-03-10T12:44:56Z",
    "type": "Ride",
    "year": 2015
  },
  {
    "date": "2015-03-18",
    "distance": 24967.7,
    "elevation_gain": 250.0,
    "id": "270267531",
    "moving_time": 3824.0,
    "name": "03/18/2015 Kilbarchan, Scotland, United Kingdom",
    "raw_activity_type": "Ride",
    "raw_type": "Ride",
    "start_date_local": "2015-03-18T16:27:39Z",
    "type": "Ride",
    "year": 2015
  },
  {
    "date": "2015-03-19",
    "distance": 11329.3,
    "elevation_gain": 242.0,
    "id": "270811421",
    "moving_time": 2116.0,
    "name": "03/19/2015 Kilbarchan, Scotland, United Kingdom",
    "raw_activity_type": "Ride",
    "raw_type": "Ride",
    "start_date_local": "2015-03-19T17:33:12Z",
    "type": "Ride",
    "year": 2015
  },
  {
    "date": "2015-03-23",
    "distance": 9385.9,
    "elevation_gain": 228.0,
    "id": "273041539",
    "moving_time": 1734.0,
    "name": "03/23/2015 Kilbarchan, Scotland, United Kingdom",
    "raw_activity_type": "Ride",
    "raw_type": "Ride",
    "start_date_local": "2015-03-23T17:30:24Z",
    "type": "Ride",
    "year": 2015
  },
  {
    "date": "2015-03-25",
    "distance": 31156.2,
    "elevation_gain": 278.0,
    "id": "273863037",
    "moving_time": 4886.0,
    "name": "03/25/2015 Kilbarchan, Scotland, United Kingdom",
    "raw_activity_type": "Ride",
    "raw_type": "Ride",
    "start_date_local": "2015-03-25T12:13:50Z",
    "type": "Ride",
    "year": 2015
  },
  {
    "date": "2015-04-04",
    "distance": 23863.0,
    "elevation_gain": 202.0,
    "id": "278877752",
    "moving_time": 3470.0,
    "name": "04/04/2015 Kilbarchan, Scotland, United Kingdom",
    "raw_activity_type": "Ride",
    "raw_type": "Ride",
    "start_date_local": "2015-04-04T08:58:42Z",
    "type": "Ride",
    "year": 2015
  },
  {
    "date": "2015-04-07",
    "distance": 36054.1,
    "elevation_gain": 535.0,
    "id": "280860965",
    "moving_time": 5952.0,
    "name": "04/07/2015 Kilbarchan, Scotland, United Kingdom",
    "raw_activity_type": "Ride",
    "raw_type": "Ride",
    "start_date_local": "2015-04-07T12:24:03Z",
    "type": "Ride",
    "year": 2015
  },
  {
    "date": "2015-04-08",
    "distance": 36205.6,
    "elevation_gain": 191.0,
    "id": "281501213",
    "moving_time": 5390.0,
    "name": "04/08/2015 Kilbarchan, Scotland, United Kingdom",
    "raw_activity_type": "Ride",
    "raw_type": "Ride",
    "start_date_local": "2015-04-08T13:24:38Z",
    "type": "Ride",
    "year": 2015
  },
  {
    "date": "2015-04-15",
    "distance": 14428.4,
    "elevation_gain": 75.0,
    "id": "286057016",
    "moving_time": 2273.0,
    "name": "04/15/2015 Kilbarchan, Scotland, United Kingdom",
    "raw_activity_type": "Ride",
    "raw_type": "Ride",
    "start_date_local": "2015-04-15T18:43:20Z",
    "type": "Ride",
    "year": 2015
  },
  {
    "date": "2015-04-17",
    "distance": 23680.8,
    "elevation_gain": 207.0,
    "id": "287266489",
    "moving_time": 3381.0,
    "name": "04/17/2015 Kilbarchan, Scotland, United Kingdom",
    "raw_activity_type": "Ride",
    "raw_type": "Ride",
    "start_date_local": "2015-04-17T18:19:25Z",
    "type": "Ride",
    "year": 2015
  },
  {
    "date": "2015-04-19",
    "distance": 48840.6,
    "elevation_gain": 809.0,
    "id": "288535048",
    "moving_time": 8069.0,
    "name": "04/19/2015 Balloch, United Kingdom",
    "raw_activity_type": "Ride",
    "raw_type": "Ride",
    "start_date_local": "2015-04-19T12:23:08Z",
    "type": "Ride",
    "year": 2015
  },
  {
    "date": "2015-04-23",
    "distance": 17389.1,
    "elevation_gain": 231.0,
    "id": "291169486",
    "moving_time": 2622.0,
    "name": "04/23/2015 Kilbarchan, Scotland, United Kingdom",
    "raw_activity_type": "Ride",
    "raw_type": "Ride",
    "start_date_local": "2015-04-23T18:02:41Z",
    "type": "Ride",
    "year": 2015
  },
  {
    "date": "2015-04-25",
    "distance": 65396.2,
    "elevation_gain": 667.0,
    "id": "292259964",
    "moving_time": 9901.0,
    "name": "04/25/2015 Kilbarchan, Scotland, United Kingdom",
    "raw_activity_type": "Ride",
    "raw_type": "Ride",
    "start_date_local": "2015-04-25T12:54:22Z",
    "type": "Ride",
    "year": 2015
  },
  {
    "date": "2015-05-04",
    "distance": 27408.7,
    "elevation_gain": 348.0,
    "id": "297923812",
    "moving_time": 4763.0,
    "name": "05/04/2015 Kilbarchan, Scotland, United Kingdom",
    "raw_activity_type": "Ride",
    "raw_type": "Ride",
    "start_date_local": "2015-05-04T11:29:27Z",
    "type": "Ride",
    "year": 2015
  },
  {
    "date": "2015-05-11",
    "distance": 22255.1,
    "elevation_gain": 233.0,
    "id": "302544402",
    "moving_time": 3307.0,
    "name": "05/11/2015 Kilbarchan, Scotland, United Kingdom",
    "raw_activity_type": "Ride",
    "raw_type": "Ride",
    "start_date_local": "2015-05-11T18:16:25Z",
    "type": "Ride",
    "year": 2015
  },
  {
    "date": "2015-05-13",
    "distance": 21659.8,
    "elevation_gain": 215.0,
    "id": "303840769",
    "moving_time": 3336.0,
    "name": "05/13/2015 Kilbarchan, Scotland, United Kingdom",
    "raw_activity_type": "Ride",
    "raw_type": "Ride",
    "start_date_local": "2015-05-13T17:59:34Z",
    "type": "Ride",
    "year": 2015
  },
  {
    "date": "2015-05-16",
    "distance": 32951.6,
    "elevation_gain": 323.0,
    "id": "306297026",
    "moving_time": 4955.0,
    "name": "05/16/2015 Caldercruix, United Kingdom",
    "raw_activity_type": "Ride",
    "raw_type": "Ride",
    "start_date_local": "2015-05-16T12:56:06Z",
    "type": "Ride",
    "year": 2015
  },
  {
    "date": "2015-05-16",
    "distance": 33273.2,
    "elevation_gain": 594.0,
    "id": "306297030",
    "moving_time": 7204.0,
    "name": "05/16/2015 Livingston, United Kingdom",
    "raw_activity_type": "Ride",
    "raw_type": "Ride",
    "start_date_local": "2015-05-16T14:40:49Z",
    "type": "Ride",
    "year": 2015
  },
  {
    "date": "2015-05-23",
    "distance": 34831.6,
    "elevation_gain": 501.0,
    "id": "310009512",
    "moving_time": 5769.0,
    "name": "05/23/2015 Kilbarchan, Scotland, United Kingdom",
    "raw_activity_type": "Ride",
    "raw_type": "Ride",
    "start_date_local": "2015-05-23T11:55:25Z",
    "type": "Ride",
    "year": 2015
  },
  {
    "date": "2015-05-30",
    "distance": 47460.5,
    "elevation_gain": 402.0,
    "id": "314788053",
    "moving_time": 7173.0,
    "name": "05/30/2015 Kilbarchan, Scotland, United Kingdom",
    "raw_activity_type": "Ride",
    "raw_type": "Ride",
    "start_date_local": "2015-05-30T12:24:35Z",
    "type": "Ride",
    "year": 2015
  },
  {
    "date": "2015-06-03",
    "distance": 4942.9,
    "elevation_gain": 86.0,
    "id": "321216788",
    "moving_time": 741.0,
    "name": "06/03/2015 Kilbarchan, Scotland, United Kingdom",
    "raw_activity_type": "Ride",
    "raw_type": "Ride",
    "start_date_local": "2015-06-03T17:12:17Z",
    "type": "Ride",
    "year": 2015
  },
  {
    "date": "2015-06-08",
    "distance": 24641.6,
    "elevation_gain": 183.0,
    "id": "321216793",
    "moving_time": 3874.0,
    "name": "06/08/2015 Kilbarchan, Scotland, United Kingdom",
    "raw_activity_type": "Ride",
    "raw_type": "Ride",
    "start_date_local": "2015-06-08T17:08:44Z",
    "type": "Ride",
    "year": 2015
  },
  {
    "date": "2015-06-09",
    "distance": 23746.7,
    "elevation_gain": 204.0,
    "id": "321835775",
    "moving_time": 3466.0,
    "name": "06/09/2015 Kilbarchan, Scotland, United Kingdom",
    "raw_activity_type": "Ride",
    "raw_type": "Ride",
    "start_date_local": "2015-06-09T17:10:13Z",
    "type": "Ride",
    "year": 2015
  },
  {
    "date": "2015-06-11",
    "distance": 15576.7,
    "elevation_gain": 168.9,
    "id": "323488152",
    "moving_time": 3930.0,
    "name": "Evening Ride",
    "raw_activity_type": "Ride",
    "raw_type": "Ride",
    "start_date_local": "2015-06-11T19:11:08Z",
    "type": "Ride",
    "year": 2015
  },
  {
    "date": "2015-06-14",
    "distance": 21525.8,
    "elevation_gain": 215.0,
    "id": "325460058",
    "moving_time": 3409.0,
    "name": "06/14/2015 Kilbarchan, Scotland, United Kingdom",
    "raw_activity_type": "Ride",
    "raw_type": "Ride",
    "start_date_local": "2015-06-14T17:12:22Z",
    "type": "Ride",
    "year": 2015
  },
  {
    "date": "2015-06-22",
    "distance": 14373.4,
    "elevation_gain": 306.0,
    "id": "332065953",
    "moving_time": 2574.0,
    "name": "06/22/2015 Lairg, United Kingdom",
    "raw_activity_type": "Ride",
    "raw_type": "Ride",
    "start_date_local": "2015-06-22T16:25:35Z",
    "type": "Ride",
    "year": 2015
  },
  {
    "date": "2015-06-23",
    "distance": 68393.5,
    "elevation_gain": 1509.0,
    "id": "332065986",
    "moving_time": 13154.0,
    "name": "06/23/2015 Lairg, United Kingdom",
    "raw_activity_type": "Ride",
    "raw_type": "Ride",
    "start_date_local": "2015-06-23T09:54:06Z",
    "type": "Ride",
    "year": 2015
  },
  {
    "date": "2015-06-26",
    "distance": 18389.2,
    "elevation_gain": 228.0,
    "id": "333408733",
    "moving_time": 3038.0,
    "name": "06/26/2015 Kilbarchan, Scotland, United Kingdom",
    "raw_activity_type": "Ride",
    "raw_type": "Ride",
    "start_date_local": "2015-06-26T15:05:54Z",
    "type": "Ride",
    "year": 2015
  },
  {
    "date": "2015-06-27",
    "distance": 40853.2,
    "elevation_gain": 339.0,
    "id": "334073204",
    "moving_time": 6645.0,
    "name": "06/27/2015 Kilbarchan, Scotland, United Kingdom",
    "raw_activity_type": "Ride",
    "raw_type": "Ride",
    "start_date_local": "2015-06-27T13:22:32Z",
    "type": "Ride",
    "year": 2015
  },
  {
    "date": "2015-06-30",
    "distance": 20071.5,
    "elevation_gain": 276.0,
    "id": "336326287",
    "moving_time": 3006.0,
    "name": "06/30/2015 Kilbarchan, Scotland, United Kingdom",
    "raw_activity_type": "Ride",
    "raw_type": "Ride",
    "start_date_local": "2015-06-30T18:43:28Z",
    "type": "Ride",
    "year": 2015
  },
  {
    "date": "2015-07-01",
    "distance": 34950.2,
    "elevation_gain": 289.0,
    "id": "337139626",
    "moving_time": 5294.0,
    "name": "07/01/2015 Kilbarchan, Scotland, United Kingdom",
    "raw_activity_type": "Ride",
    "raw_type": "Ride",
    "start_date_local": "2015-07-01T19:33:43Z",
    "type": "Ride",
    "year": 2015
  },
  {
    "date": "2015-07-27",
    "distance": 11880.0,
    "elevation_gain": 42.0,
    "id": "355323429",
    "moving_time": 1731.0,
    "name": "07/27/2015 Kilbarchan, Scotland, United Kingdom",
    "raw_activity_type": "Ride",
    "raw_type": "Ride",
    "start_date_local": "2015-07-27T18:07:15Z",
    "type": "Ride",
    "year": 2015
  },
  {
    "date": "2015-07-27",
    "distance": 10298.7,
    "elevation_gain": 163.0,
    "id": "355323443",
    "moving_time": 1836.0,
    "name": "07/27/2015 Kilbarchan, United Kingdom",
    "raw_activity_type": "Ride",
    "raw_type": "Ride",
    "start_date_local": "2015-07-27T18:43:13Z",
    "type": "Ride",
    "year": 2015
  },
  {
    "date": "2015-07-30",
    "distance": 26056.3,
    "elevation_gain": 345.0,
    "id": "357470596",
    "moving_time": 4275.0,
    "name": "07/30/2015 Kilbarchan, Scotland, United Kingdom",
    "raw_activity_type": "Ride",
    "raw_type": "Ride",
    "start_date_local": "2015-07-30T18:04:32Z",
    "type": "Ride",
    "year": 2015
  },
  {
    "date": "2015-08-03",
    "distance": 24315.9,
    "elevation_gain": 257.0,
    "id": "360426007",
    "moving_time": 3641.0,
    "name": "08/03/2015 Kilbarchan, Scotland, United Kingdom",
    "raw_activity_type": "Ride",
    "raw_type": "Ride",
    "start_date_local": "2015-08-03T17:08:21Z",
    "type": "Ride",
    "year": 2015
  },
  {
    "date": "2015-08-05",
    "distance": 32976.7,
    "elevation_gain": 497.0,
    "id": "361940116",
    "moving_time": 5265.0,
    "name": "08/05/2015 Kilbarchan, Scotland, United Kingdom",
    "raw_activity_type": "Ride",
    "raw_type": "Ride",
    "start_date_local": "2015-08-05T17:08:42Z",
    "type": "Ride",
    "year": 2015
  },
  {
    "date": "2015-08-07",
    "distance": 23592.1,
    "elevation_gain": 306.0,
    "id": "363485168",
    "moving_time": 4003.0,
    "name": "08/07/2015 Kilbarchan, Scotland, United Kingdom",
    "raw_activity_type": "Ride",
    "raw_type": "Ride",
    "start_date_local": "2015-08-07T17:12:43Z",
    "type": "Ride",
    "year": 2015
  },
  {
    "date": "2015-08-11",
    "distance": 24537.6,
    "elevation_gain": 298.0,
    "id": "366679332",
    "moving_time": 3740.0,
    "name": "08/11/2015 Kilbarchan, Scotland, United Kingdom",
    "raw_activity_type": "Ride",
    "raw_type": "Ride",
    "start_date_local": "2015-08-11T18:10:19Z",
    "type": "Ride",
    "year": 2015
  },
  {
    "date": "2015-08-16",
    "distance": 38162.7,
    "elevation_gain": 420.0,
    "id": "370512902",
    "moving_time": 5535.0,
    "name": "08/16/2015 Caldercruix, United Kingdom",
    "raw_activity_type": "Ride",
    "raw_type": "Ride",
    "start_date_local": "2015-08-16T14:37:51Z",
    "type": "Ride",
    "year": 2015
  },
  {
    "date": "2015-08-17",
    "distance": 39437.9,
    "elevation_gain": 317.0,
    "id": "371041689",
    "moving_time": 6042.0,
    "name": "08/17/2015 Caldercruix, United Kingdom",
    "raw_activity_type": "Ride",
    "raw_type": "Ride",
    "start_date_local": "2015-08-17T12:42:10Z",
    "type": "Ride",
    "year": 2015
  },
  {
    "date": "2015-08-24",
    "distance": 26496.5,
    "elevation_gain": 385.0,
    "id": "376477789",
    "moving_time": 4049.0,
    "name": "Afternoon Ride",
    "raw_activity_type": "Ride",
    "raw_type": "Ride",
    "start_date_local": "2015-08-24T15:37:26Z",
    "type": "Ride",
    "year": 2015
  },
  {
    "date": "2015-08-25",
    "distance": 52599.0,
    "elevation_gain": 597.0,
    "id": "377146973",
    "moving_time": 7935.0,
    "name": "Afternoon Ride",
    "raw_activity_type": "Ride",
    "raw_type": "Ride",
    "start_date_local": "2015-08-25T13:58:40Z",
    "type": "Ride",
    "year": 2015
  },
  {
    "date": "2015-08-28",
    "distance": 24649.8,
    "elevation_gain": 347.0,
    "id": "379233338",
    "moving_time": 3914.0,
    "name": "Lunch Ride",
    "raw_activity_type": "Ride",
    "raw_type": "Ride",
    "start_date_local": "2015-08-28T11:20:38Z",
    "type": "Ride",
    "year": 2015
  },
  {
    "date": "2015-09-29",
    "distance": 2307.6,
    "elevation_gain": 15.4,
    "id": "402525353",
    "moving_time": 175.0,
    "name": "To work",
    "raw_activity_type": "Ride",
    "raw_type": "Ride",
    "start_date_local": "2015-09-29T07:12:01Z",
    "type": "Ride",
    "year": 2015
  },
  {
    "date": "2015-09-29",
    "distance": 16460.3,
    "elevation_gain": 158.0,
    "id": "402893431",
    "moving_time": 2306.0,
    "name": "Evening Ride",
    "raw_activity_type": "Ride",
    "raw_type": "Ride",
    "start_date_local": "2015-09-29T18:07:57Z",
    "type": "Ride",
    "year": 2015
  },
  {
    "date": "2015-11-02",
    "distance": 20773.3,
    "elevation_gain": 177.0,
    "id": "425120253",
    "moving_time": 3302.0,
    "name": "Afternoon Ride",
    "raw_activity_type": "Ride",
    "raw_type": "Ride",
    "start_date_local": "2015-11-02T13:39:48Z",
    "type": "Ride",
    "year": 2015
  },
  {
    "date": "2016-04-03",
    "distance": 4108.3,
    "elevation_gain": 83.0,
    "id": "657762413",
    "moving_time": 971.0,
    "name": "Afternoon Ride",
    "raw_activity_type": "Ride",
    "raw_type": "Ride",
    "start_date_local": "2016-04-03T13:32:56Z",
    "type": "Ride",
    "year": 2016
  },
  {
    "date": "2016-04-03",
    "distance": 3742.5,
    "elevation_gain": 13.0,
    "id": "657762417",
    "moving_time": 782.0,
    "name": "Afternoon Ride",
    "raw_activity_type": "Ride",
    "raw_type": "Ride",
    "start_date_local": "2016-04-03T16:03:35Z",
    "type": "Ride",
    "year": 2016
  },
  {
    "date": "2016-05-13",
    "distance": 8875.4,
    "elevation_gain": 91.0,
    "id": "575003189",
    "moving_time": 1537.0,
    "name": "Evening Ride",
    "raw_activity_type": "Ride",
    "raw_type": "Ride",
    "start_date_local": "2016-05-13T20:05:21Z",
    "type": "Ride",
    "year": 2016
  },
  {
    "date": "2016-05-14",
    "distance": 10757.0,
    "elevation_gain": 94.0,
    "id": "575979569",
    "moving_time": 1828.0,
    "name": "Afternoon Ride",
    "raw_activity_type": "Ride",
    "raw_type": "Ride",
    "start_date_local": "2016-05-14T14:05:23Z",
    "type": "Ride",
    "year": 2016
  },
  {
    "date": "2016-05-29",
    "distance": 13862.3,
    "elevation_gain": 200.0,
    "id": "592175015",
    "moving_time": 2684.0,
    "name": "Lost in the city",
    "raw_activity_type": "Ride",
    "raw_type": "Ride",
    "start_date_local": "2016-05-29T17:00:19Z",
    "type": "Ride",
    "year": 2016
  },
  {
    "date": "2016-06-01",
    "distance": 9533.7,
    "elevation_gain": 102.0,
    "id": "595121412",
    "moving_time": 1851.0,
    "name": "Sunny Spin",
    "raw_activity_type": "Ride",
    "raw_type": "Ride",
    "start_date_local": "2016-06-01T15:51:17Z",
    "type": "Ride",
    "year": 2016
  },
  {
    "date": "2016-06-05",
    "distance": 30592.8,
    "elevation_gain": 375.0,
    "id": "599244927",
    "moving_time": 5647.0,
    "name": "All over Edinburgh",
    "raw_activity_type": "Ride",
    "raw_type": "Ride",
    "start_date_local": "2016-06-05T11:36:16Z",
    "type": "Ride",
    "year": 2016
  },
  {
    "date": "2016-07-02",
    "distance": 54541.1,
    "elevation_gain": 728.0,
    "id": "627540592",
    "moving_time": 10333.0,
    "name": "Over the bridge!",
    "raw_activity_type": "Ride",
    "raw_type": "Ride",
    "start_date_local": "2016-07-02T10:59:39Z",
    "type": "Ride",
    "year": 2016
  },
  {
    "date": "2016-07-23",
    "distance": 40126.6,
    "elevation_gain": 330.0,
    "id": "651160293",
    "moving_time": 6430.0,
    "name": "Saturday Spinner",
    "raw_activity_type": "Ride",
    "raw_type": "Ride",
    "start_date_local": "2016-07-23T13:18:03Z",
    "type": "Ride",
    "year": 2016
  },
  {
    "date": "2016-07-29",
    "distance": 17371.7,
    "elevation_gain": 181.0,
    "id": "657762486",
    "moving_time": 2553.0,
    "name": "Evening Ride",
    "raw_activity_type": "Ride",
    "raw_type": "Ride",
    "start_date_local": "2016-07-29T19:16:12Z",
    "type": "Ride",
    "year": 2016
  },
  {
    "date": "2016-08-14",
    "distance": 29513.5,
    "elevation_gain": 293.0,
    "id": "675930150",
    "moving_time": 4572.0,
    "name": "Afternoon Ride",
    "raw_activity_type": "Ride",
    "raw_type": "Ride",
    "start_date_local": "2016-08-14T13:21:48Z",
    "type": "Ride",
    "year": 2016
  },
  {
    "date": "2016-08-24",
    "distance": 18422.1,
    "elevation_gain": 309.0,
    "id": "687690921",
    "moving_time": 2967.0,
    "name": "Good signal up there",
    "raw_activity_type": "Ride",
    "raw_type": "Ride",
    "start_date_local": "2016-08-24T18:57:06Z",
    "type": "Ride",
    "year": 2016
  },
  {
    "date": "2016-08-28",
    "distance": 31931.0,
    "elevation_gain": 409.0,
    "id": "692213187",
    "moving_time": 4908.0,
    "name": "Afternoon Ride",
    "raw_activity_type": "Ride",
    "raw_type": "Ride",
    "start_date_local": "2016-08-28T15:22:42Z",
    "type": "Ride",
    "year": 2016
  },
  {
    "date": "2016-09-11",
    "distance": 1637.2,
    "elevation_gain": 12.0,
    "id": "708506138",
    "moving_time": 397.0,
    "name": "Afternoon Ride",
    "raw_activity_type": "Ride",
    "raw_type": "Ride",
    "start_date_local": "2016-09-11T14:32:01Z",
    "type": "Ride",
    "year": 2016
  },
  {
    "date": "2016-09-11",
    "distance": 72556.5,
    "elevation_gain": 880.0,
    "id": "708506161",
    "moving_time": 11691.0,
    "name": "Pedal for Scotland!",
    "raw_activity_type": "Ride",
    "raw_type": "Ride",
    "start_date_local": "2016-09-11T08:07:37Z",
    "type": "Ride",
    "year": 2016
  },
  {
    "date": "2016-09-13",
    "distance": 15043.1,
    "elevation_gain": 143.0,
    "id": "711166204",
    "moving_time": 2185.0,
    "name": "Sunset Cycle",
    "raw_activity_type": "Ride",
    "raw_type": "Ride",
    "start_date_local": "2016-09-13T19:11:04Z",
    "type": "Ride",
    "year": 2016
  },
  {
    "date": "2016-09-17",
    "distance": 78832.1,
    "elevation_gain": 655.0,
    "id": "716604980",
    "moving_time": 11778.0,
    "name": "Tour de Cycle Track",
    "raw_activity_type": "Ride",
    "raw_type": "Ride",
    "start_date_local": "2016-09-17T10:48:56Z",
    "type": "Ride",
    "year": 2016
  },
  {
    "date": "2016-09-18",
    "distance": 49950.2,
    "elevation_gain": 371.0,
    "id": "716605068",
    "moving_time": 7306.0,
    "name": "Tour de Cycle Track - Part Deux",
    "raw_activity_type": "Ride",
    "raw_type": "Ride",
    "start_date_local": "2016-09-18T10:26:13Z",
    "type": "Ride",
    "year": 2016
  },
  {
    "date": "2016-10-22",
    "distance": 36322.6,
    "elevation_gain": 310.0,
    "id": "752472088",
    "moving_time": 5904.0,
    "name": "New Bike!",
    "raw_activity_type": "Ride",
    "raw_type": "Ride",
    "start_date_local": "2016-10-22T13:46:54Z",
    "type": "Ride",
    "year": 2016
  },
  {
    "date": "2016-10-30",
    "distance": 34605.1,
    "elevation_gain": 339.0,
    "id": "760466413",
    "moving_time": 5201.0,
    "name": "Always a headwind",
    "raw_activity_type": "Ride",
    "raw_type": "Ride",
    "start_date_local": "2016-10-30T11:25:19Z",
    "type": "Ride",
    "year": 2016
  },
  {
    "date": "2017-03-24",
    "distance": 8246.8,
    "elevation_gain": 69.0,
    "id": "913924630",
    "moving_time": 1203.0,
    "name": "Afternoon Ride",
    "raw_activity_type": "Ride",
    "raw_type": "Ride",
    "start_date_local": "2017-03-24T16:09:42Z",
    "type": "Ride",
    "year": 2017
  },
  {
    "date": "2017-03-25",
    "distance": 36664.6,
    "elevation_gain": 516.0,
    "id": "913924743",
    "moving_time": 5955.0,
    "name": "Cairngorms",
    "raw_activity_type": "Ride",
    "raw_type": "Ride",
    "start_date_local": "2017-03-25T12:56:23Z",
    "type": "Ride",
    "year": 2017
  },
  {
    "date": "2017-03-26",
    "distance": 27637.8,
    "elevation_gain": 206.0,
    "id": "915321094",
    "moving_time": 4339.0,
    "name": "Recovery",
    "raw_activity_type": "Ride",
    "raw_type": "Ride",
    "start_date_local": "2017-03-26T12:41:15Z",
    "type": "Ride",
    "year": 2017
  },
  {
    "date": "2017-03-27",
    "distance": 39268.2,
    "elevation_gain": 543.0,
    "id": "916624475",
    "moving_time": 6659.0,
    "name": "Got the segment this time!",
    "raw_activity_type": "Ride",
    "raw_type": "Ride",
    "start_date_local": "2017-03-27T12:16:20Z",
    "type": "Ride",
    "year": 2017
  },
  {
    "date": "2017-07-18",
    "distance": 10109.9,
    "elevation_gain": 82.0,
    "id": "3389310581",
    "moving_time": 1640.0,
    "name": "Evening Ride",
    "raw_activity_type": "Ride",
    "raw_type": "Ride",
    "start_date_local": "2017-07-18T19:08:55Z",
    "type": "Ride",
    "year": 2017
  },
  {
    "date": "2017-10-21",
    "distance": 39536.1,
    "elevation_gain": 411.0,
    "id": "1240743637",
    "moving_time": 7824.0,
    "name": "Forth Road Bridge",
    "raw_activity_type": "Ride",
    "raw_type": "Ride",
    "start_date_local": "2017-10-21T11:05:26Z",
    "type": "Ride",
    "year": 2017
  },
  {
    "date": "2018-04-21",
    "distance": 37461.3,
    "elevation_gain": 125.0,
    "id": "1522206802",
    "moving_time": 7154.0,
    "name": "The the sea",
    "raw_activity_type": "Ride",
    "raw_type": "Ride",
    "start_date_local": "2018-04-21T10:28:28Z",
    "type": "Ride",
    "year": 2018
  },
  {
    "date": "2018-05-12",
    "distance": 46329.8,
    "elevation_gain": 392.0,
    "id": "1567412257",
    "moving_time": 8730.0,
    "name": "Longniddry Loop",
    "raw_activity_type": "Ride",
    "raw_type": "Ride",
    "start_date_local": "2018-05-12T11:28:11Z",
    "type": "Ride",
    "year": 2018
  },
  {
    "date": "2018-05-14",
    "distance": 22933.0,
    "elevation_gain": 122.0,
    "id": "1572050717",
    "moving_time": 4161.0,
    "name": "Crammond Quickie",
    "raw_activity_type": "Ride",
    "raw_type": "Ride",
    "start_date_local": "2018-05-14T18:28:25Z",
    "type": "Ride",
    "year": 2018
  },
  {
    "date": "2018-06-23",
    "distance": 30675.9,
    "elevation_gain": 205.0,
    "id": "3389311036",
    "moving_time": 5526.0,
    "name": "Morning Ride",
    "raw_activity_type": "Ride",
    "raw_type": "Ride",
    "start_date_local": "2018-06-23T10:13:15Z",
    "type": "Ride",
    "year": 2018
  },
  {
    "date": "2018-08-25",
    "distance": 40582.2,
    "elevation_gain": 442.0,
    "id": "3389311110",
    "moving_time": 7622.0,
    "name": "Lunch Ride",
    "raw_activity_type": "Ride",
    "raw_type": "Ride",
    "start_date_local": "2018-08-25T11:00:45Z",
    "type": "Ride",
    "year": 2018
  },
  {
    "date": "2019-12-29",
    "distance": 3006.5,
    "elevation_gain": 0.0,
    "id": "2966101732",
    "moving_time": 1176.0,
    "name": "Afternoon Run",
    "raw_activity_type": "Run",
    "raw_type": "Run",
    "start_date_local": "2019-12-29T17:48:10Z",
    "type": "Run",
    "year": 2019
  },
  {
    "date": "2020-01-02",
    "distance": 1465.2,
    "elevation_gain": 0.0,
    "id": "2976085211",
    "moving_time": 563.0,
    "name": "Afternoon Run",
    "raw_activity_type": "Run",
    "raw_type": "Run",
    "start_date_local": "2020-01-02T17:25:45Z",
    "type": "Run",
    "year": 2020
  },
  {
    "date": "2020-01-19",
    "distance": 3102.9,
    "elevation_gain": 2.6,
    "id": "3025227314",
    "moving_time": 1079.0,
    "name": "Afternoon Run",
    "raw_activity_type": "Run",
    "raw_type": "Run",
    "start_date_local": "2020-01-19T13:57:04Z",
    "type": "Run",
    "year": 2020
  },
  {
    "date": "2020-02-08",
    "distance": 5002.5,
    "elevation_gain": 38.9,
    "id": "3082105062",
    "moving_time": 1778.0,
    "name": "First ever 5K!",
    "raw_activity_type": "Run",
    "raw_type": "Run",
    "start_date_local": "2020-02-08T12:06:41Z",
    "type": "Run",
    "year": 2020
  },
  {
    "date": "2020-03-25",
    "distance": 1403.7,
    "elevation_gain": 2.0,
    "id": "3217184639",
    "moving_time": 514.0,
    "name": "Afternoon Run",
    "raw_activity_type": "Run",
    "raw_type": "Run",
    "start_date_local": "2020-03-25T17:08:01Z",
    "type": "Run",
    "year": 2020
  },
  {
    "date": "2020-03-27",
    "distance": 2075.1,
    "elevation_gain": 19.5,
    "id": "3224852454",
    "moving_time": 709.0,
    "name": "Afternoon Run",
    "raw_activity_type": "Run",
    "raw_type": "Run",
    "start_date_local": "2020-03-27T17:05:00Z",
    "type": "Run",
    "year": 2020
  },
  {
    "date": "2020-03-30",
    "distance": 2656.8,
    "elevation_gain": 18.2,
    "id": "3235373093",
    "moving_time": 893.0,
    "name": "Afternoon Run",
    "raw_activity_type": "Run",
    "raw_type": "Run",
    "start_date_local": "2020-03-30T17:49:36Z",
    "type": "Run",
    "year": 2020
  },
  {
    "date": "2020-04-08",
    "distance": 13439.9,
    "elevation_gain": 173.0,
    "id": "3272008313",
    "moving_time": 2245.0,
    "name": "2 years aff it",
    "raw_activity_type": "Ride",
    "raw_type": "Ride",
    "start_date_local": "2020-04-08T17:09:06Z",
    "type": "Ride",
    "year": 2020
  },
  {
    "date": "2020-04-12",
    "distance": 20671.6,
    "elevation_gain": 182.0,
    "id": "3290218179",
    "moving_time": 3445.0,
    "name": "Mearns and back",
    "raw_activity_type": "Ride",
    "raw_type": "Ride",
    "start_date_local": "2020-04-12T15:28:58Z",
    "type": "Ride",
    "year": 2020
  },
  {
    "date": "2020-04-13",
    "distance": 14308.2,
    "elevation_gain": 115.0,
    "id": "3294873423",
    "moving_time": 2114.0,
    "name": "Quick one",
    "raw_activity_type": "Ride",
    "raw_type": "Ride",
    "start_date_local": "2020-04-13T17:29:06Z",
    "type": "Ride",
    "year": 2020
  },
  {
    "date": "2020-04-19",
    "distance": 41017.1,
    "elevation_gain": 481.0,
    "id": "3323046040",
    "moving_time": 6944.0,
    "name": "Good tailwind means bad headwind",
    "raw_activity_type": "Ride",
    "raw_type": "Ride",
    "start_date_local": "2020-04-19T15:49:51Z",
    "type": "Ride",
    "year": 2020
  },
  {
    "date": "2020-05-01",
    "distance": 4227.7,
    "elevation_gain": 42.0,
    "id": "3380825008",
    "moving_time": 721.0,
    "name": "Soaking wet ride",
    "raw_activity_type": "Ride",
    "raw_type": "Ride",
    "start_date_local": "2020-05-01T17:29:03Z",
    "type": "Ride",
    "year": 2020
  },
  {
    "date": "2020-05-03",
    "distance": 23412.5,
    "elevation_gain": 255.0,
    "id": "3392031841",
    "moving_time": 3535.0,
    "name": "Afternoon Ride",
    "raw_activity_type": "Ride",
    "raw_type": "Ride",
    "start_date_local": "2020-05-03T15:30:12Z",
    "type": "Ride",
    "year": 2020
  },
  {
    "date": "2020-05-05",
    "distance": 14213.4,
    "elevation_gain": 117.0,
    "id": "3402338767",
    "moving_time": 2429.0,
    "name": "Afternoon Ride",
    "raw_activity_type": "Ride",
    "raw_type": "Ride",
    "start_date_local": "2020-05-05T15:41:53Z",
    "type": "Ride",
    "year": 2020
  },
  {
    "date": "2020-05-08",
    "distance": 38414.7,
    "elevation_gain": 394.0,
    "id": "3419893020",
    "moving_time": 5798.0,
    "name": "Afternoon Ride",
    "raw_activity_type": "Ride",
    "raw_type": "Ride",
    "start_date_local": "2020-05-08T16:26:02Z",
    "type": "Ride",
    "year": 2020
  },
  {
    "date": "2020-05-12",
    "distance": 23085.2,
    "elevation_gain": 267.0,
    "id": "3438848554",
    "moving_time": 3389.0,
    "name": "Lunch Ride",
    "raw_activity_type": "Ride",
    "raw_type": "Ride",
    "start_date_local": "2020-05-12T12:04:37Z",
    "type": "Ride",
    "year": 2020
  },
  {
    "date": "2020-05-14",
    "distance": 20107.7,
    "elevation_gain": 90.0,
    "id": "3449085201",
    "moving_time": 3348.0,
    "name": "Lunch Ride",
    "raw_activity_type": "Ride",
    "raw_type": "Ride",
    "start_date_local": "2020-05-14T11:06:58Z",
    "type": "Ride",
    "year": 2020
  },
  {
    "date": "2020-05-20",
    "distance": 80893.2,
    "elevation_gain": 315.0,
    "id": "3483700698",
    "moving_time": 13072.0,
    "name": "Afternoon Ride",
    "raw_activity_type": "Ride",
    "raw_type": "Ride",
    "start_date_local": "2020-05-20T14:03:44Z",
    "type": "Ride",
    "year": 2020
  },
  {
    "date": "2020-05-24",
    "distance": 24886.8,
    "elevation_gain": 156.0,
    "id": "3504163329",
    "moving_time": 4031.0,
    "name": "Afternoon Ride",
    "raw_activity_type": "Ride",
    "raw_type": "Ride",
    "start_date_local": "2020-05-24T13:49:24Z",
    "type": "Ride",
    "year": 2020
  },
  {
    "date": "2020-05-25",
    "distance": 23492.0,
    "elevation_gain": 259.0,
    "id": "3509023659",
    "moving_time": 3420.0,
    "name": "Afternoon Ride",
    "raw_activity_type": "Ride",
    "raw_type": "Ride",
    "start_date_local": "2020-05-25T13:30:31Z",
    "type": "Ride",
    "year": 2020
  },
  {
    "date": "2020-05-28",
    "distance": 62432.2,
    "elevation_gain": 444.0,
    "id": "3525626391",
    "moving_time": 10247.0,
    "name": "Morning Ride",
    "raw_activity_type": "Ride",
    "raw_type": "Ride",
    "start_date_local": "2020-05-28T10:56:20Z",
    "type": "Ride",
    "year": 2020
  },
  {
    "date": "2020-05-31",
    "distance": 38568.8,
    "elevation_gain": 403.0,
    "id": "3539699138",
    "moving_time": 5509.0,
    "name": "Morning Ride",
    "raw_activity_type": "Ride",
    "raw_type": "Ride",
    "start_date_local": "2020-05-31T07:16:14Z",
    "type": "Ride",
    "year": 2020
  },
  {
    "date": "2020-06-01",
    "distance": 23447.4,
    "elevation_gain": 257.0,
    "id": "3548754840",
    "moving_time": 3217.0,
    "name": "Evening Ride",
    "raw_activity_type": "Ride",
    "raw_type": "Ride",
    "start_date_local": "2020-06-01T18:30:48Z",
    "type": "Ride",
    "year": 2020
  },
  {
    "date": "2020-06-06",
    "distance": 30459.4,
    "elevation_gain": 409.0,
    "id": "3572986276",
    "moving_time": 4395.0,
    "name": "Afternoon Ride",
    "raw_activity_type": "Ride",
    "raw_type": "Ride",
    "start_date_local": "2020-06-06T15:05:39Z",
    "type": "Ride",
    "year": 2020
  },
  {
    "date": "2020-06-07",
    "distance": 47469.5,
    "elevation_gain": 453.0,
    "id": "3578342688",
    "moving_time": 7677.0,
    "name": "Lunch Ride",
    "raw_activity_type": "Ride",
    "raw_type": "Ride",
    "start_date_local": "2020-06-07T11:40:33Z",
    "type": "Ride",
    "year": 2020
  },
  {
    "date": "2020-06-11",
    "distance": 4009.1,
    "elevation_gain": 28.0,
    "id": "3600063319",
    "moving_time": 717.0,
    "name": "Night Ride",
    "raw_activity_type": "Ride",
    "raw_type": "Ride",
    "start_date_local": "2020-06-11T21:34:30Z",
    "type": "Ride",
    "year": 2020
  },
  {
    "date": "2020-06-11",
    "distance": 22631.8,
    "elevation_gain": 254.0,
    "id": "3600063341",
    "moving_time": 3080.0,
    "name": "Evening Ride",
    "raw_activity_type": "Ride",
    "raw_type": "Ride",
    "start_date_local": "2020-06-11T20:38:59Z",
    "type": "Ride",
    "year": 2020
  },
  {
    "date": "2020-06-13",
    "distance": 22017.5,
    "elevation_gain": 292.0,
    "id": "3609755004",
    "moving_time": 3549.0,
    "name": "Evening Ride",
    "raw_activity_type": "Ride",
    "raw_type": "Ride",
    "start_date_local": "2020-06-13T19:08:47Z",
    "type": "Ride",
    "year": 2020
  },
  {
    "date": "2020-06-14",
    "distance": 60238.1,
    "elevation_gain": 644.0,
    "id": "3615402466",
    "moving_time": 9157.0,
    "name": "Afternoon Ride",
    "raw_activity_type": "Ride",
    "raw_type": "Ride",
    "start_date_local": "2020-06-14T16:43:26Z",
    "type": "Ride",
    "year": 2020
  },
  {
    "date": "2020-06-18",
    "distance": 18144.0,
    "elevation_gain": 156.0,
    "id": "3633861624",
    "moving_time": 3003.0,
    "name": "Afternoon Ride",
    "raw_activity_type": "Ride",
    "raw_type": "Ride",
    "start_date_local": "2020-06-18T14:28:29Z",
    "type": "Ride",
    "year": 2020
  },
  {
    "date": "2020-06-20",
    "distance": 101899.0,
    "elevation_gain": 1392.6,
    "id": "3643210490",
    "moving_time": 15288.0,
    "name": "Troon!",
    "raw_activity_type": "Ride",
    "raw_type": "Ride",
    "start_date_local": "2020-06-20T08:28:11Z",
    "type": "Ride",
    "year": 2020
  },
  {
    "date": "2020-06-25",
    "distance": 29235.8,
    "elevation_gain": 330.0,
    "id": "3670231162",
    "moving_time": 4260.0,
    "name": "Afternoon Ride",
    "raw_activity_type": "Ride",
    "raw_type": "Ride",
    "start_date_local": "2020-06-25T17:10:53Z",
    "type": "Ride",
    "year": 2020
  },
  {
    "date": "2020-06-26",
    "distance": 23833.4,
    "elevation_gain": 271.0,
    "id": "3675181912",
    "moving_time": 3140.0,
    "name": "Evening Ride",
    "raw_activity_type": "Ride",
    "raw_type": "Ride",
    "start_date_local": "2020-06-26T19:19:20Z",
    "type": "Ride",
    "year": 2020
  },
  {
    "date": "2020-06-30",
    "distance": 41111.9,
    "elevation_gain": 448.0,
    "id": "3694152392",
    "moving_time": 6332.0,
    "name": "Afternoon Ride",
    "raw_activity_type": "Ride",
    "raw_type": "Ride",
    "start_date_local": "2020-06-30T17:19:02Z",
    "type": "Ride",
    "year": 2020
  },
  {
    "date": "2020-07-04",
    "distance": 31467.6,
    "elevation_gain": 449.0,
    "id": "3712593027",
    "moving_time": 4753.0,
    "name": "Afternoon Ride",
    "raw_activity_type": "Ride",
    "raw_type": "Ride",
    "start_date_local": "2020-07-04T14:30:25Z",
    "type": "Ride",
    "year": 2020
  },
  {
    "date": "2020-07-06",
    "distance": 46215.9,
    "elevation_gain": 605.0,
    "id": "3723115158",
    "moving_time": 6955.0,
    "name": "Afternoon Ride",
    "raw_activity_type": "Ride",
    "raw_type": "Ride",
    "start_date_local": "2020-07-06T16:44:38Z",
    "type": "Ride",
    "year": 2020
  },
  {
    "date": "2020-07-09",
    "distance": 23793.2,
    "elevation_gain": 281.0,
    "id": "3736207785",
    "moving_time": 3029.0,
    "name": "Lunch Ride",
    "raw_activity_type": "Ride",
    "raw_type": "Ride",
    "start_date_local": "2020-07-09T12:53:20Z",
    "type": "Ride",
    "year": 2020
  },
  {
    "date": "2020-07-11",
    "distance": 121813.0,
    "elevation_gain": 1294.0,
    "id": "3746585412",
    "moving_time": 19243.0,
    "name": "Morning Ride",
    "raw_activity_type": "Ride",
    "raw_type": "Ride",
    "start_date_local": "2020-07-11T09:58:40Z",
    "type": "Ride",
    "year": 2020
  },
  {
    "date": "2020-07-13",
    "distance": 23835.2,
    "elevation_gain": 294.0,
    "id": "3757687243",
    "moving_time": 3535.0,
    "name": "Evening Ride",
    "raw_activity_type": "Ride",
    "raw_type": "Ride",
    "start_date_local": "2020-07-13T19:32:07Z",
    "type": "Ride",
    "year": 2020
  },
  {
    "date": "2020-07-20",
    "distance": 23842.4,
    "elevation_gain": 305.0,
    "id": "3791443272",
    "moving_time": 3160.0,
    "name": "Afternoon Ride",
    "raw_activity_type": "Ride",
    "raw_type": "Ride",
    "start_date_local": "2020-07-20T17:37:38Z",
    "type": "Ride",
    "year": 2020
  },
  {
    "date": "2020-07-21",
    "distance": 39292.3,
    "elevation_gain": 409.0,
    "id": "3795482430",
    "moving_time": 5478.0,
    "name": "Afternoon Ride",
    "raw_activity_type": "Ride",
    "raw_type": "Ride",
    "start_date_local": "2020-07-21T13:10:57Z",
    "type": "Ride",
    "year": 2020
  },
  {
    "date": "2020-07-28",
    "distance": 23874.3,
    "elevation_gain": 300.0,
    "id": "3828439387",
    "moving_time": 3263.0,
    "name": "Afternoon Ride",
    "raw_activity_type": "Ride",
    "raw_type": "Ride",
    "start_date_local": "2020-07-28T17:39:05Z",
    "type": "Ride",
    "year": 2020
  },
  {
    "date": "2020-07-31",
    "distance": 72639.9,
    "elevation_gain": 822.0,
    "id": "3843171721",
    "moving_time": 12060.0,
    "name": "Morning Ride",
    "raw_activity_type": "Ride",
    "raw_type": "Ride",
    "start_date_local": "2020-07-31T08:40:57Z",
    "type": "Ride",
    "year": 2020
  },
  {
    "date": "2020-08-08",
    "distance": 89683.0,
    "elevation_gain": 981.0,
    "id": "3884242449",
    "moving_time": 14686.0,
    "name": "Afternoon Ride",
    "raw_activity_type": "Ride",
    "raw_type": "Ride",
    "start_date_local": "2020-08-08T13:46:19Z",
    "type": "Ride",
    "year": 2020
  },
  {
    "date": "2020-08-11",
    "distance": 23451.7,
    "elevation_gain": 269.0,
    "id": "3898077873",
    "moving_time": 2925.0,
    "name": "Afternoon Ride",
    "raw_activity_type": "Ride",
    "raw_type": "Ride",
    "start_date_local": "2020-08-11T16:38:40Z",
    "type": "Ride",
    "year": 2020
  },
  {
    "date": "2020-08-12",
    "distance": 23504.9,
    "elevation_gain": 266.0,
    "id": "3903925822",
    "moving_time": 2860.0,
    "name": "Evening Ride",
    "raw_activity_type": "Ride",
    "raw_type": "Ride",
    "start_date_local": "2020-08-12T19:39:48Z",
    "type": "Ride",
    "year": 2020
  },
  {
    "date": "2020-08-14",
    "distance": 38589.3,
    "elevation_gain": 412.0,
    "id": "3913003612",
    "moving_time": 5189.0,
    "name": "Evening Ride",
    "raw_activity_type": "Ride",
    "raw_type": "Ride",
    "start_date_local": "2020-08-14T18:03:10Z",
    "type": "Ride",
    "year": 2020
  },
  {
    "date": "2020-08-20",
    "distance": 20645.2,
    "elevation_gain": 251.0,
    "id": "3941912487",
    "moving_time": 2907.0,
    "name": "Evening Ride",
    "raw_activity_type": "Ride",
    "raw_type": "Ride",
    "start_date_local": "2020-08-20T18:15:01Z",
    "type": "Ride",
    "year": 2020
  },
  {
    "date": "2020-08-23",
    "distance": 4538.9,
    "elevation_gain": 61.0,
    "id": "3955192368",
    "moving_time": 724.0,
    "name": "Afternoon Ride",
    "raw_activity_type": "Ride",
    "raw_type": "Ride",
    "start_date_local": "2020-08-23T13:38:33Z",
    "type": "Ride",
    "year": 2020
  },
  {
    "date": "2020-08-23",
    "distance": 55249.4,
    "elevation_gain": 651.0,
    "id": "3955196283",
    "moving_time": 7753.0,
    "name": "Afternoon Ride",
    "raw_activity_type": "Ride",
    "raw_type": "Ride",
    "start_date_local": "2020-08-23T13:55:26Z",
    "type": "Ride",
    "year": 2020
  },
  {
    "date": "2020-08-28",
    "distance": 23501.7,
    "elevation_gain": 301.0,
    "id": "3978736862",
    "moving_time": 2988.0,
    "name": "Evening Ride",
    "raw_activity_type": "Ride",
    "raw_type": "Ride",
    "start_date_local": "2020-08-28T19:01:58Z",
    "type": "Ride",
    "year": 2020
  },
  {
    "date": "2020-09-01",
    "distance": 27995.6,
    "elevation_gain": 371.0,
    "id": "3997188980",
    "moving_time": 3923.0,
    "name": "Afternoon Ride",
    "raw_activity_type": "Ride",
    "raw_type": "Ride",
    "start_date_local": "2020-09-01T17:06:34Z",
    "type": "Ride",
    "year": 2020
  },
  {
    "date": "2020-09-06",
    "distance": 34655.1,
    "elevation_gain": 555.0,
    "id": "4021456240",
    "moving_time": 4991.0,
    "name": "Afternoon Ride",
    "raw_activity_type": "Ride",
    "raw_type": "Ride",
    "start_date_local": "2020-09-06T15:02:24Z",
    "type": "Ride",
    "year": 2020
  },
  {
    "date": "2020-09-08",
    "distance": 27953.0,
    "elevation_gain": 407.0,
    "id": "4030969268",
    "moving_time": 4317.0,
    "name": "Wet & Windy",
    "raw_activity_type": "Ride",
    "raw_type": "Ride",
    "start_date_local": "2020-09-08T17:18:19Z",
    "type": "Ride",
    "year": 2020
  },
  {
    "date": "2020-09-14",
    "distance": 16801.7,
    "elevation_gain": 318.0,
    "id": "4057578606",
    "moving_time": 2764.0,
    "name": "Kilchoan to Sanna",
    "raw_activity_type": "Ride",
    "raw_type": "Ride",
    "start_date_local": "2020-09-14T09:28:51Z",
    "type": "Ride",
    "year": 2020
  },
  {
    "date": "2020-09-15",
    "distance": 28009.9,
    "elevation_gain": 491.0,
    "id": "4062487843",
    "moving_time": 4416.0,
    "name": "Brothers on Bikes",
    "raw_activity_type": "Ride",
    "raw_type": "Ride",
    "start_date_local": "2020-09-15T10:16:41Z",
    "type": "Ride",
    "year": 2020
  },
  {
    "date": "2020-09-18",
    "distance": 34987.1,
    "elevation_gain": 543.0,
    "id": "4077763218",
    "moving_time": 5006.0,
    "name": "Afternoon Ride",
    "raw_activity_type": "Ride",
    "raw_type": "Ride",
    "start_date_local": "2020-09-18T13:55:19Z",
    "type": "Ride",
    "year": 2020
  },
  {
    "date": "2020-09-20",
    "distance": 90072.3,
    "elevation_gain": 998.0,
    "id": "4088904372",
    "moving_time": 12089.0,
    "name": "Afternoon Ride",
    "raw_activity_type": "Ride",
    "raw_type": "Ride",
    "start_date_local": "2020-09-20T14:02:03Z",
    "type": "Ride",
    "year": 2020
  },
  {
    "date": "2020-09-25",
    "distance": 28064.8,
    "elevation_gain": 392.0,
    "id": "4110959077",
    "moving_time": 3879.0,
    "name": "Afternoon Ride",
    "raw_activity_type": "Ride",
    "raw_type": "Ride",
    "start_date_local": "2020-09-25T17:04:01Z",
    "type": "Ride",
    "year": 2020
  },
  {
    "date": "2020-10-01",
    "distance": 23556.5,
    "elevation_gain": 288.0,
    "id": "4138097083",
    "moving_time": 3260.0,
    "name": "Afternoon Ride",
    "raw_activity_type": "Ride",
    "raw_type": "Ride",
    "start_date_local": "2020-10-01T17:32:32Z",
    "type": "Ride",
    "year": 2020
  },
  {
    "date": "2020-10-08",
    "distance": 23508.3,
    "elevation_gain": 273.0,
    "id": "4168534516",
    "moving_time": 3369.0,
    "name": "Afternoon Ride",
    "raw_activity_type": "Ride",
    "raw_type": "Ride",
    "start_date_local": "2020-10-08T17:33:42Z",
    "type": "Ride",
    "year": 2020
  },
  {
    "date": "2020-10-11",
    "distance": 62007.4,
    "elevation_gain": 787.0,
    "id": "4181951202",
    "moving_time": 9693.0,
    "name": "Lunch Ride",
    "raw_activity_type": "Ride",
    "raw_type": "Ride",
    "start_date_local": "2020-10-11T12:59:51Z",
    "type": "Ride",
    "year": 2020
  },
  {
    "date": "2020-10-22",
    "distance": 27974.4,
    "elevation_gain": 367.0,
    "id": "4229380584",
    "moving_time": 4177.0,
    "name": "Afternoon Ride",
    "raw_activity_type": "Ride",
    "raw_type": "Ride",
    "start_date_local": "2020-10-22T16:36:11Z",
    "type": "Ride",
    "year": 2020
  },
  {
    "date": "2020-10-30",
    "distance": 11024.7,
    "elevation_gain": 0.0,
    "id": "4263474732",
    "moving_time": 1317.0,
    "name": "First zwift ride",
    "raw_activity_type": "VirtualRide",
    "raw_type": "VirtualRide",
    "start_date_local": "2020-10-30T19:10:05Z",
    "type": "VirtualRide",
    "year": 2020
  },
  {
    "date": "2020-11-01",
    "distance": 51934.1,
    "elevation_gain": 752.0,
    "id": "4271752396",
    "moving_time": 9371.0,
    "name": "Morning Ride",
    "raw_activity_type": "Ride",
    "raw_type": "Ride",
    "start_date_local": "2020-11-01T10:55:13Z",
    "type": "Ride",
    "year": 2020
  },
  {
    "date": "2020-11-03",
    "distance": 7522.3,
    "elevation_gain": 236.0,
    "id": "4281577558",
    "moving_time": 2059.0,
    "name": "Build Me Up - Zone Benchmarking",
    "raw_activity_type": "VirtualRide",
    "raw_type": "VirtualRide",
    "start_date_local": "2020-11-03T17:51:51Z",
    "type": "VirtualRide",
    "year": 2020
  },
  {
    "date": "2020-11-04",
    "distance": 6149.2,
    "elevation_gain": 154.0,
    "id": "4286731438",
    "moving_time": 1799.0,
    "name": "Build Me Up - Pedaling Drills",
    "raw_activity_type": "VirtualRide",
    "raw_type": "VirtualRide",
    "start_date_local": "2020-11-04T19:54:21Z",
    "type": "VirtualRide",
    "year": 2020
  },
  {
    "date": "2020-11-11",
    "distance": 23039.9,
    "elevation_gain": 426.0,
    "id": "4322140073",
    "moving_time": 3605.0,
    "name": "Build Me Up - What Goes Up, Must Come Down",
    "raw_activity_type": "VirtualRide",
    "raw_type": "VirtualRide",
    "start_date_local": "2020-11-11T12:05:20Z",
    "type": "VirtualRide",
    "year": 2020
  },
  {
    "date": "2020-11-14",
    "distance": 26504.9,
    "elevation_gain": 236.0,
    "id": "4337762598",
    "moving_time": 3734.0,
    "name": "Build Me Up - Halvfems",
    "raw_activity_type": "VirtualRide",
    "raw_type": "VirtualRide",
    "start_date_local": "2020-11-14T16:53:23Z",
    "type": "VirtualRide",
    "year": 2020
  },
  {
    "date": "2020-11-15",
    "distance": 6600.7,
    "elevation_gain": 326.0,
    "id": "4342988432",
    "moving_time": 2334.0,
    "name": "Build Me Up - Orange Unicorn",
    "raw_activity_type": "VirtualRide",
    "raw_type": "VirtualRide",
    "start_date_local": "2020-11-15T16:27:45Z",
    "type": "VirtualRide",
    "year": 2020
  },
  {
    "date": "2020-11-28",
    "distance": 39607.9,
    "elevation_gain": 433.0,
    "id": "4401511189",
    "moving_time": 6395.0,
    "name": "Morning Ride",
    "raw_activity_type": "Ride",
    "raw_type": "Ride",
    "start_date_local": "2020-11-28T10:15:40Z",
    "type": "Ride",
    "year": 2020
  },
  {
    "date": "2020-12-11",
    "distance": 16207.6,
    "elevation_gain": 275.0,
    "id": "4458355856",
    "moving_time": 2899.0,
    "name": "FTP Builder - Foundation",
    "raw_activity_type": "VirtualRide",
    "raw_type": "VirtualRide",
    "start_date_local": "2020-12-11T13:38:18Z",
    "type": "VirtualRide",
    "year": 2020
  },
  {
    "date": "2020-12-31",
    "distance": 10946.8,
    "elevation_gain": 202.0,
    "id": "4544460325",
    "moving_time": 1816.0,
    "name": "Emily's Short Mix",
    "raw_activity_type": "VirtualRide",
    "raw_type": "VirtualRide",
    "start_date_local": "2020-12-31T13:56:21Z",
    "type": "VirtualRide",
    "year": 2020
  },
  {
    "date": "2021-01-01",
    "distance": 13102.4,
    "elevation_gain": 152.0,
    "id": "4550130369",
    "moving_time": 1821.0,
    "name": "2 By 2",
    "raw_activity_type": "VirtualRide",
    "raw_type": "VirtualRide",
    "start_date_local": "2021-01-01T17:27:47Z",
    "type": "VirtualRide",
    "year": 2021
  },
  {
    "date": "2021-01-04",
    "distance": 10532.2,
    "elevation_gain": 57.0,
    "id": "4567132835",
    "moving_time": 1206.0,
    "name": "Miracle",
    "raw_activity_type": "VirtualRide",
    "raw_type": "VirtualRide",
    "start_date_local": "2021-01-04T18:21:56Z",
    "type": "VirtualRide",
    "year": 2021
  },
  {
    "date": "2021-01-08",
    "distance": 22920.6,
    "elevation_gain": 241.0,
    "id": "4587684266",
    "moving_time": 3319.0,
    "name": "2x15 FTP Intervals",
    "raw_activity_type": "VirtualRide",
    "raw_type": "VirtualRide",
    "start_date_local": "2021-01-08T16:05:00Z",
    "type": "VirtualRide",
    "year": 2021
  },
  {
    "date": "2021-01-14",
    "distance": 16892.1,
    "elevation_gain": 130.0,
    "id": "4620529791",
    "moving_time": 2597.0,
    "name": "The Wringer",
    "raw_activity_type": "VirtualRide",
    "raw_type": "VirtualRide",
    "start_date_local": "2021-01-14T17:51:40Z",
    "type": "VirtualRide",
    "year": 2021
  },
  {
    "date": "2021-01-17",
    "distance": 9529.7,
    "elevation_gain": 167.0,
    "id": "4636958389",
    "moving_time": 1420.0,
    "name": "Duncan McNaught's Meetup",
    "raw_activity_type": "VirtualRide",
    "raw_type": "VirtualRide",
    "start_date_local": "2021-01-17T15:39:58Z",
    "type": "VirtualRide",
    "year": 2021
  },
  {
    "date": "2021-01-23",
    "distance": 11473.9,
    "elevation_gain": 204.0,
    "id": "4669434370",
    "moving_time": 1702.0,
    "name": "Yorkshire",
    "raw_activity_type": "VirtualRide",
    "raw_type": "VirtualRide",
    "start_date_local": "2021-01-23T17:40:47Z",
    "type": "VirtualRide",
    "year": 2021
  },
  {
    "date": "2021-01-29",
    "distance": 11668.3,
    "elevation_gain": 155.0,
    "id": "4700673424",
    "moving_time": 1714.0,
    "name": "Lavender Unicorn",
    "raw_activity_type": "VirtualRide",
    "raw_type": "VirtualRide",
    "start_date_local": "2021-01-29T16:38:55Z",
    "type": "VirtualRide",
    "year": 2021
  },
  {
    "date": "2021-02-03",
    "distance": 7927.4,
    "elevation_gain": 48.0,
    "id": "4729499766",
    "moving_time": 1210.0,
    "name": "Vault",
    "raw_activity_type": "VirtualRide",
    "raw_type": "VirtualRide",
    "start_date_local": "2021-02-03T19:41:38Z",
    "type": "VirtualRide",
    "year": 2021
  },
  {
    "date": "2021-02-05",
    "distance": 26425.5,
    "elevation_gain": 240.0,
    "id": "4740298861",
    "moving_time": 3595.0,
    "name": "London",
    "raw_activity_type": "VirtualRide",
    "raw_type": "VirtualRide",
    "start_date_local": "2021-02-05T18:52:37Z",
    "type": "VirtualRide",
    "year": 2021
  },
  {
    "date": "2021-02-07",
    "distance": 20947.6,
    "elevation_gain": 276.0,
    "id": "4750811063",
    "moving_time": 3047.0,
    "name": "Afternoon Ride",
    "raw_activity_type": "Ride",
    "raw_type": "Ride",
    "start_date_local": "2021-02-07T14:11:56Z",
    "type": "Ride",
    "year": 2021
  },
  {
    "date": "2021-02-11",
    "distance": 10063.6,
    "elevation_gain": 126.0,
    "id": "4771413709",
    "moving_time": 1255.0,
    "name": "NYC",
    "raw_activity_type": "VirtualRide",
    "raw_type": "VirtualRide",
    "start_date_local": "2021-02-11T17:13:32Z",
    "type": "VirtualRide",
    "year": 2021
  },
  {
    "date": "2021-02-15",
    "distance": 23088.7,
    "elevation_gain": 154.0,
    "id": "4792611480",
    "moving_time": 2985.0,
    "name": "Fraser Clark's Meetup",
    "raw_activity_type": "VirtualRide",
    "raw_type": "VirtualRide",
    "start_date_local": "2021-02-15T18:14:01Z",
    "type": "VirtualRide",
    "year": 2021
  },
  {
    "date": "2021-02-28",
    "distance": 17658.5,
    "elevation_gain": 367.0,
    "id": "4867558725",
    "moving_time": 3016.0,
    "name": "Afternoon Ride",
    "raw_activity_type": "Ride",
    "raw_type": "Ride",
    "start_date_local": "2021-02-28T16:15:51Z",
    "type": "Ride",
    "year": 2021
  },
  {
    "date": "2021-03-01",
    "distance": 20187.3,
    "elevation_gain": 245.0,
    "id": "4872390872",
    "moving_time": 2902.0,
    "name": "Afternoon Ride",
    "raw_activity_type": "Ride",
    "raw_type": "Ride",
    "start_date_local": "2021-03-01T16:05:57Z",
    "type": "Ride",
    "year": 2021
  },
  {
    "date": "2021-03-12",
    "distance": 8089.8,
    "elevation_gain": 114.0,
    "id": "4934334355",
    "moving_time": 1348.0,
    "name": "Rear brake stopped working",
    "raw_activity_type": "Ride",
    "raw_type": "Ride",
    "start_date_local": "2021-03-12T14:54:57Z",
    "type": "Ride",
    "year": 2021
  },
  {
    "date": "2021-03-24",
    "distance": 4734.0,
    "elevation_gain": 85.0,
    "id": "5002668881",
    "moving_time": 819.0,
    "name": "Afternoon Ride",
    "raw_activity_type": "Ride",
    "raw_type": "Ride",
    "start_date_local": "2021-03-24T15:30:32Z",
    "type": "Ride",
    "year": 2021
  },
  {
    "date": "2021-04-01",
    "distance": 28986.3,
    "elevation_gain": 433.0,
    "id": "5050722507",
    "moving_time": 4521.0,
    "name": "Afternoon Ride",
    "raw_activity_type": "Ride",
    "raw_type": "Ride",
    "start_date_local": "2021-04-01T16:41:37Z",
    "type": "Ride",
    "year": 2021
  },
  {
    "date": "2021-04-02",
    "distance": 38587.9,
    "elevation_gain": 349.0,
    "id": "5056153040",
    "moving_time": 5857.0,
    "name": "Afternoon Ride",
    "raw_activity_type": "Ride",
    "raw_type": "Ride",
    "start_date_local": "2021-04-02T14:41:47Z",
    "type": "Ride",
    "year": 2021
  },
  {
    "date": "2021-04-06",
    "distance": 3169.2,
    "elevation_gain": 12.5,
    "id": "5079376863",
    "moving_time": 1873.0,
    "name": "Afternoon Run",
    "raw_activity_type": "Run",
    "raw_type": "Run",
    "start_date_local": "2021-04-06T14:58:21Z",
    "type": "Run",
    "year": 2021
  },
  {
    "date": "2021-04-07",
    "distance": 3057.9,
    "elevation_gain": 15.2,
    "id": "5085785521",
    "moving_time": 1549.0,
    "name": "Afternoon Run",
    "raw_activity_type": "Run",
    "raw_type": "Run",
    "start_date_local": "2021-04-07T17:28:52Z",
    "type": "Run",
    "year": 2021
  },
  {
    "date": "2021-04-08",
    "distance": 3402.4,
    "elevation_gain": 28.8,
    "id": "5091775571",
    "moving_time": 1150.0,
    "name": "Evening Run",
    "raw_activity_type": "Run",
    "raw_type": "Run",
    "start_date_local": "2021-04-08T18:00:06Z",
    "type": "Run",
    "year": 2021
  },
  {
    "date": "2021-04-12",
    "distance": 2770.3,
    "elevation_gain": 13.8,
    "id": "5115680406",
    "moving_time": 1272.0,
    "name": "Evening Run",
    "raw_activity_type": "Run",
    "raw_type": "Run",
    "start_date_local": "2021-04-12T19:56:19Z",
    "type": "Run",
    "year": 2021
  },
  {
    "date": "2021-04-13",
    "distance": 28908.1,
    "elevation_gain": 435.0,
    "id": "5119016093",
    "moving_time": 4388.0,
    "name": "Lunch Ride",
    "raw_activity_type": "Ride",
    "raw_type": "Ride",
    "start_date_local": "2021-04-13T12:09:13Z",
    "type": "Ride",
    "year": 2021
  },
  {
    "date": "2021-04-14",
    "distance": 54242.2,
    "elevation_gain": 656.0,
    "id": "5127055269",
    "moving_time": 8206.0,
    "name": "Afternoon Ride",
    "raw_activity_type": "Ride",
    "raw_type": "Ride",
    "start_date_local": "2021-04-14T16:31:30Z",
    "type": "Ride",
    "year": 2021
  },
  {
    "date": "2021-04-17",
    "distance": 63441.4,
    "elevation_gain": 946.0,
    "id": "5142882083",
    "moving_time": 10018.0,
    "name": "Lunch Ride",
    "raw_activity_type": "Ride",
    "raw_type": "Ride",
    "start_date_local": "2021-04-17T12:39:03Z",
    "type": "Ride",
    "year": 2021
  },
  {
    "date": "2021-04-20",
    "distance": 9254.8,
    "elevation_gain": 0.0,
    "id": "5162927011",
    "moving_time": 1278.0,
    "name": "Ramp Test",
    "raw_activity_type": "Ride",
    "raw_type": "Ride",
    "start_date_local": "2021-04-20T21:09:40Z",
    "type": "Ride",
    "year": 2021
  },
  {
    "date": "2021-04-21",
    "distance": 2578.9,
    "elevation_gain": 23.5,
    "id": "5165783723",
    "moving_time": 801.0,
    "name": "Lunch Run",
    "raw_activity_type": "Run",
    "raw_type": "Run",
    "start_date_local": "2021-04-21T12:39:50Z",
    "type": "Run",
    "year": 2021
  },
  {
    "date": "2021-04-23",
    "distance": 109675.0,
    "elevation_gain": 1147.0,
    "id": "5178871114",
    "moving_time": 17454.0,
    "name": "Lunch Ride",
    "raw_activity_type": "Ride",
    "raw_type": "Ride",
    "start_date_local": "2021-04-23T11:05:30Z",
    "type": "Ride",
    "year": 2021
  },
  {
    "date": "2021-04-24",
    "distance": 4186.9,
    "elevation_gain": 23.5,
    "id": "5184523585",
    "moving_time": 4625.0,
    "name": "Litter picking!",
    "raw_activity_type": "Walk",
    "raw_type": "Walk",
    "start_date_local": "2021-04-24T14:26:06Z",
    "type": "Walk",
    "year": 2021
  },
  {
    "date": "2021-04-25",
    "distance": 14553.5,
    "elevation_gain": 151.0,
    "id": "5192186608",
    "moving_time": 4159.0,
    "name": "Lunch Ride",
    "raw_activity_type": "Ride",
    "raw_type": "Ride",
    "start_date_local": "2021-04-25T12:53:03Z",
    "type": "Ride",
    "year": 2021
  },
  {
    "date": "2021-04-27",
    "distance": 19065.8,
    "elevation_gain": 0.0,
    "id": "5201266815",
    "moving_time": 2700.0,
    "name": "Goddard -4",
    "raw_activity_type": "Ride",
    "raw_type": "Ride",
    "start_date_local": "2021-04-27T13:21:15Z",
    "type": "Ride",
    "year": 2021
  },
  {
    "date": "2021-04-29",
    "distance": 23419.5,
    "elevation_gain": 0.0,
    "id": "5212464480",
    "moving_time": 3600.0,
    "name": "Ericsson -1",
    "raw_activity_type": "Ride",
    "raw_type": "Ride",
    "start_date_local": "2021-04-29T12:10:29Z",
    "type": "Ride",
    "year": 2021
  },
  {
    "date": "2021-04-30",
    "distance": 5023.9,
    "elevation_gain": 36.5,
    "id": "5219343321",
    "moving_time": 1692.0,
    "name": "Evening Run",
    "raw_activity_type": "Run",
    "raw_type": "Run",
    "start_date_local": "2021-04-30T18:26:48Z",
    "type": "Run",
    "year": 2021
  },
  {
    "date": "2021-05-02",
    "distance": 35203.8,
    "elevation_gain": 0.0,
    "id": "5229531146",
    "moving_time": 5400.0,
    "name": "Baxter",
    "raw_activity_type": "Ride",
    "raw_type": "Ride",
    "start_date_local": "2021-05-02T11:39:52Z",
    "type": "Ride",
    "year": 2021
  },
  {
    "date": "2021-05-05",
    "distance": 22554.0,
    "elevation_gain": 0.0,
    "id": "5247579942",
    "moving_time": 3600.0,
    "name": "Goddard",
    "raw_activity_type": "Ride",
    "raw_type": "Ride",
    "start_date_local": "2021-05-05T18:35:18Z",
    "type": "Ride",
    "year": 2021
  },
  {
    "date": "2021-05-06",
    "distance": 24960.6,
    "elevation_gain": 0.0,
    "id": "5252420343",
    "moving_time": 3600.0,
    "name": "Monitor",
    "raw_activity_type": "Ride",
    "raw_type": "Ride",
    "start_date_local": "2021-05-06T17:29:09Z",
    "type": "Ride",
    "year": 2021
  },
  {
    "date": "2021-05-09",
    "distance": 28887.6,
    "elevation_gain": 456.0,
    "id": "5269083249",
    "moving_time": 4465.0,
    "name": "Windy windy windy",
    "raw_activity_type": "Ride",
    "raw_type": "Ride",
    "start_date_local": "2021-05-09T15:36:26Z",
    "type": "Ride",
    "year": 2021
  },
  {
    "date": "2021-05-10",
    "distance": 20139.9,
    "elevation_gain": 0.0,
    "id": "5273944836",
    "moving_time": 3600.0,
    "name": "Ericsson",
    "raw_activity_type": "Ride",
    "raw_type": "Ride",
    "start_date_local": "2021-05-10T16:52:02Z",
    "type": "Ride",
    "year": 2021
  },
  {
    "date": "2021-05-11",
    "distance": 25362.2,
    "elevation_gain": 0.0,
    "id": "5280407342",
    "moving_time": 3600.0,
    "name": "Carson",
    "raw_activity_type": "Ride",
    "raw_type": "Ride",
    "start_date_local": "2021-05-11T19:00:40Z",
    "type": "Ride",
    "year": 2021
  },
  {
    "date": "2021-05-13",
    "distance": 29075.0,
    "elevation_gain": 448.0,
    "id": "5291612222",
    "moving_time": 4387.0,
    "name": "Back up the bonnyton",
    "raw_activity_type": "Ride",
    "raw_type": "Ride",
    "start_date_local": "2021-05-13T18:14:24Z",
    "type": "Ride",
    "year": 2021
  },
  {
    "date": "2021-05-15",
    "distance": 1340.5,
    "elevation_gain": 0.0,
    "id": "5302429382",
    "moving_time": 661.0,
    "name": "Run with Lisa!",
    "raw_activity_type": "Run",
    "raw_type": "Run",
    "start_date_local": "2021-05-15T18:04:07Z",
    "type": "Run",
    "year": 2021
  },
  {
    "date": "2021-05-16",
    "distance": 37740.1,
    "elevation_gain": 0.0,
    "id": "5309612221",
    "moving_time": 5400.0,
    "name": "Eclipse",
    "raw_activity_type": "Ride",
    "raw_type": "Ride",
    "start_date_local": "2021-05-16T20:41:00Z",
    "type": "Ride",
    "year": 2021
  },
  {
    "date": "2021-05-17",
    "distance": 3051.0,
    "elevation_gain": 9.5,
    "id": "5313033563",
    "moving_time": 892.0,
    "name": "Afternoon Run",
    "raw_activity_type": "Run",
    "raw_type": "Run",
    "start_date_local": "2021-05-17T17:46:45Z",
    "type": "Run",
    "year": 2021
  },
  {
    "date": "2021-05-19",
    "distance": 24431.9,
    "elevation_gain": 263.0,
    "id": "5325158915",
    "moving_time": 3679.0,
    "name": "Quick one on the winter bike",
    "raw_activity_type": "Ride",
    "raw_type": "Ride",
    "start_date_local": "2021-05-19T18:46:21Z",
    "type": "Ride",
    "year": 2021
  },
  {
    "date": "2021-05-26",
    "distance": 28428.9,
    "elevation_gain": 378.0,
    "id": "5363119901",
    "moving_time": 4162.0,
    "name": "Exploring some news roads",
    "raw_activity_type": "Ride",
    "raw_type": "Ride",
    "start_date_local": "2021-05-26T19:26:44Z",
    "type": "Ride",
    "year": 2021
  },
  {
    "date": "2021-05-27",
    "distance": 44556.9,
    "elevation_gain": 548.0,
    "id": "5367620084",
    "moving_time": 6785.0,
    "name": "Very windy",
    "raw_activity_type": "Ride",
    "raw_type": "Ride",
    "start_date_local": "2021-05-27T16:16:18Z",
    "type": "Ride",
    "year": 2021
  },
  {
    "date": "2021-05-30",
    "distance": 2728.5,
    "elevation_gain": 160.0,
    "id": "5383277125",
    "moving_time": 751.0,
    "name": "Duke's Pass Climb",
    "raw_activity_type": "Ride",
    "raw_type": "Ride",
    "start_date_local": "2021-05-30T13:51:55Z",
    "type": "Ride",
    "year": 2021
  },
  {
    "date": "2021-05-30",
    "distance": 47471.5,
    "elevation_gain": 681.0,
    "id": "5384302996",
    "moving_time": 7503.0,
    "name": "Tour de Lochs",
    "raw_activity_type": "Ride",
    "raw_type": "Ride",
    "start_date_local": "2021-05-30T14:06:27Z",
    "type": "Ride",
    "year": 2021
  },
  {
    "date": "2021-05-31",
    "distance": 28265.7,
    "elevation_gain": 387.0,
    "id": "5390521928",
    "moving_time": 4041.0,
    "name": "Evening Ride",
    "raw_activity_type": "Ride",
    "raw_type": "Ride",
    "start_date_local": "2021-05-31T18:26:44Z",
    "type": "Ride",
    "year": 2021
  },
  {
    "date": "2021-06-02",
    "distance": 24116.7,
    "elevation_gain": 0.0,
    "id": "5401795664",
    "moving_time": 3600.0,
    "name": "Pettit",
    "raw_activity_type": "Ride",
    "raw_type": "Ride",
    "start_date_local": "2021-06-02T17:23:48Z",
    "type": "Ride",
    "year": 2021
  },
  {
    "date": "2021-06-04",
    "distance": 28197.9,
    "elevation_gain": 386.0,
    "id": "5411687316",
    "moving_time": 3963.0,
    "name": "Up the dams",
    "raw_activity_type": "Ride",
    "raw_type": "Ride",
    "start_date_local": "2021-06-04T12:30:19Z",
    "type": "Ride",
    "year": 2021
  },
  {
    "date": "2021-06-04",
    "distance": 23859.0,
    "elevation_gain": 0.0,
    "id": "5412744307",
    "moving_time": 3600.0,
    "name": "Bald Knob",
    "raw_activity_type": "Ride",
    "raw_type": "Ride",
    "start_date_local": "2021-06-04T16:20:27Z",
    "type": "Ride",
    "year": 2021
  },
  {
    "date": "2021-06-07",
    "distance": 44006.6,
    "elevation_gain": 476.0,
    "id": "5430470464",
    "moving_time": 6447.0,
    "name": "Windy up the wind farm",
    "raw_activity_type": "Ride",
    "raw_type": "Ride",
    "start_date_local": "2021-06-07T16:54:06Z",
    "type": "Ride",
    "year": 2021
  },
  {
    "date": "2021-06-08",
    "distance": 10096.7,
    "elevation_gain": 0.0,
    "id": "5434064186",
    "moving_time": 1429.0,
    "name": "Ramp Test",
    "raw_activity_type": "Ride",
    "raw_type": "Ride",
    "start_date_local": "2021-06-08T11:57:27Z",
    "type": "Ride",
    "year": 2021
  },
  {
    "date": "2021-06-08",
    "distance": 2513.9,
    "elevation_gain": 2.6,
    "id": "5435806906",
    "moving_time": 837.0,
    "name": "Afternoon Run",
    "raw_activity_type": "Run",
    "raw_type": "Run",
    "start_date_local": "2021-06-08T17:51:04Z",
    "type": "Run",
    "year": 2021
  },
  {
    "date": "2021-06-10",
    "distance": 24712.7,
    "elevation_gain": 0.0,
    "id": "5448301576",
    "moving_time": 3600.0,
    "name": "Ebbetts",
    "raw_activity_type": "Ride",
    "raw_type": "Ride",
    "start_date_local": "2021-06-10T19:38:28Z",
    "type": "Ride",
    "year": 2021
  },
  {
    "date": "2021-06-13",
    "distance": 100548.0,
    "elevation_gain": 962.0,
    "id": "5464126817",
    "moving_time": 16583.0,
    "name": "Windiest ride of my life",
    "raw_activity_type": "Ride",
    "raw_type": "Ride",
    "start_date_local": "2021-06-13T10:43:32Z",
    "type": "Ride",
    "year": 2021
  },
  {
    "date": "2021-06-17",
    "distance": 27720.6,
    "elevation_gain": 351.0,
    "id": "5485033929",
    "moving_time": 3890.0,
    "name": "Lunchtime ride up bonnyton",
    "raw_activity_type": "Ride",
    "raw_type": "Ride",
    "start_date_local": "2021-06-17T12:51:09Z",
    "type": "Ride",
    "year": 2021
  },
  {
    "date": "2021-06-17",
    "distance": 23798.7,
    "elevation_gain": 0.0,
    "id": "5486299137",
    "moving_time": 3600.0,
    "name": "Taylor -2",
    "raw_activity_type": "Ride",
    "raw_type": "Ride",
    "start_date_local": "2021-06-17T17:40:29Z",
    "type": "Ride",
    "year": 2021
  },
  {
    "date": "2021-06-21",
    "distance": 26585.4,
    "elevation_gain": 0.0,
    "id": "5507620191",
    "moving_time": 3600.0,
    "name": "Donner",
    "raw_activity_type": "Ride",
    "raw_type": "Ride",
    "start_date_local": "2021-06-21T19:57:14Z",
    "type": "Ride",
    "year": 2021
  },
  {
    "date": "2021-06-22",
    "distance": 27828.7,
    "elevation_gain": 328.0,
    "id": "5512989236",
    "moving_time": 3801.0,
    "name": "Evening Ride",
    "raw_activity_type": "Ride",
    "raw_type": "Ride",
    "start_date_local": "2021-06-22T19:48:15Z",
    "type": "Ride",
    "year": 2021
  },
  {
    "date": "2021-06-24",
    "distance": 24880.8,
    "elevation_gain": 0.0,
    "id": "5521860300",
    "moving_time": 3600.0,
    "name": "Bluebell",
    "raw_activity_type": "Ride",
    "raw_type": "Ride",
    "start_date_local": "2021-06-24T14:02:58Z",
    "type": "Ride",
    "year": 2021
  },
  {
    "date": "2021-06-27",
    "distance": 30178.2,
    "elevation_gain": 372.0,
    "id": "5537172841",
    "moving_time": 4560.0,
    "name": "Up the Kirk",
    "raw_activity_type": "Ride",
    "raw_type": "Ride",
    "start_date_local": "2021-06-27T11:18:16Z",
    "type": "Ride",
    "year": 2021
  },
  {
    "date": "2021-06-27",
    "distance": 27744.6,
    "elevation_gain": 311.0,
    "id": "5539996737",
    "moving_time": 3741.0,
    "name": "Quick bonnyton",
    "raw_activity_type": "Ride",
    "raw_type": "Ride",
    "start_date_local": "2021-06-27T19:48:08Z",
    "type": "Ride",
    "year": 2021
  },
  {
    "date": "2021-06-29",
    "distance": 76266.6,
    "elevation_gain": 777.0,
    "id": "5549449363",
    "moving_time": 10917.0,
    "name": "Hot & hilly",
    "raw_activity_type": "Ride",
    "raw_type": "Ride",
    "start_date_local": "2021-06-29T16:08:26Z",
    "type": "Ride",
    "year": 2021
  },
  {
    "date": "2021-07-04",
    "distance": 27244.6,
    "elevation_gain": 0.0,
    "id": "5576213951",
    "moving_time": 3600.0,
    "name": "Darwin",
    "raw_activity_type": "Ride",
    "raw_type": "Ride",
    "start_date_local": "2021-07-04T20:54:54Z",
    "type": "Ride",
    "year": 2021
  },
  {
    "date": "2021-07-06",
    "distance": 25758.7,
    "elevation_gain": 0.0,
    "id": "5584092684",
    "moving_time": 3600.0,
    "name": "Jepson",
    "raw_activity_type": "Ride",
    "raw_type": "Ride",
    "start_date_local": "2021-07-06T13:34:59Z",
    "type": "Ride",
    "year": 2021
  },
  {
    "date": "2021-07-09",
    "distance": 23726.5,
    "elevation_gain": 0.0,
    "id": "5601476683",
    "moving_time": 3600.0,
    "name": "Spencer +2",
    "raw_activity_type": "Ride",
    "raw_type": "Ride",
    "start_date_local": "2021-07-09T20:31:24Z",
    "type": "Ride",
    "year": 2021
  },
  {
    "date": "2021-07-12",
    "distance": 26849.1,
    "elevation_gain": 0.0,
    "id": "5617448654",
    "moving_time": 3600.0,
    "name": "Lamarck",
    "raw_activity_type": "Ride",
    "raw_type": "Ride",
    "start_date_local": "2021-07-12T20:18:47Z",
    "type": "Ride",
    "year": 2021
  },
  {
    "date": "2021-07-15",
    "distance": 25442.7,
    "elevation_gain": 245.0,
    "id": "5633258479",
    "moving_time": 3662.0,
    "name": "Not a good time",
    "raw_activity_type": "Ride",
    "raw_type": "Ride",
    "start_date_local": "2021-07-15T19:38:28Z",
    "type": "Ride",
    "year": 2021
  },
  {
    "date": "2021-07-18",
    "distance": 44408.5,
    "elevation_gain": 472.0,
    "id": "5648353525",
    "moving_time": 5969.0,
    "name": "A few climbs",
    "raw_activity_type": "Ride",
    "raw_type": "Ride",
    "start_date_local": "2021-07-18T15:24:19Z",
    "type": "Ride",
    "year": 2021
  },
  {
    "date": "2021-07-20",
    "distance": 22831.1,
    "elevation_gain": 217.0,
    "id": "5658869027",
    "moving_time": 2889.0,
    "name": "Far far too hot",
    "raw_activity_type": "Ride",
    "raw_type": "Ride",
    "start_date_local": "2021-07-20T17:39:13Z",
    "type": "Ride",
    "year": 2021
  },
  {
    "date": "2021-07-23",
    "distance": 2533.9,
    "elevation_gain": 8.9,
    "id": "5673179236",
    "moving_time": 1147.0,
    "name": "Run with Lisa",
    "raw_activity_type": "Run",
    "raw_type": "Run",
    "start_date_local": "2021-07-23T10:58:56Z",
    "type": "Run",
    "year": 2021
  },
  {
    "date": "2021-07-27",
    "distance": 3773.8,
    "elevation_gain": 14.1,
    "id": "5696101897",
    "moving_time": 1331.0,
    "name": "Slow and steady",
    "raw_activity_type": "Run",
    "raw_type": "Run",
    "start_date_local": "2021-07-27T17:14:17Z",
    "type": "Run",
    "year": 2021
  },
  {
    "date": "2021-07-28",
    "distance": 9503.8,
    "elevation_gain": 0.0,
    "id": "5701659255",
    "moving_time": 1225.0,
    "name": "Ramp Test",
    "raw_activity_type": "Ride",
    "raw_type": "Ride",
    "start_date_local": "2021-07-28T17:47:42Z",
    "type": "Ride",
    "year": 2021
  },
  {
    "date": "2021-08-01",
    "distance": 3261.8,
    "elevation_gain": 30.8,
    "id": "5723337196",
    "moving_time": 1095.0,
    "name": "Run in the park",
    "raw_activity_type": "Run",
    "raw_type": "Run",
    "start_date_local": "2021-08-01T20:10:49Z",
    "type": "Run",
    "year": 2021
  },
  {
    "date": "2021-08-02",
    "distance": 33296.2,
    "elevation_gain": 83.0,
    "id": "5726736233",
    "moving_time": 4613.0,
    "name": "At the track with Rab",
    "raw_activity_type": "Ride",
    "raw_type": "Ride",
    "start_date_local": "2021-08-02T14:30:46Z",
    "type": "Ride",
    "year": 2021
  },
  {
    "date": "2021-08-03",
    "distance": 2016.3,
    "elevation_gain": 11.4,
    "id": "5734167533",
    "moving_time": 616.0,
    "name": "Short & fast (for me)",
    "raw_activity_type": "Run",
    "raw_type": "Run",
    "start_date_local": "2021-08-03T21:12:44Z",
    "type": "Run",
    "year": 2021
  },
  {
    "date": "2021-08-07",
    "distance": 2824.6,
    "elevation_gain": 5.5,
    "id": "5755219285",
    "moving_time": 825.0,
    "name": "Very wet run",
    "raw_activity_type": "Run",
    "raw_type": "Run",
    "start_date_local": "2021-08-07T20:52:23Z",
    "type": "Run",
    "year": 2021
  },
  {
    "date": "2021-08-14",
    "distance": 27702.8,
    "elevation_gain": 309.0,
    "id": "5792610996",
    "moving_time": 3955.0,
    "name": "First ride in 2 weeks!",
    "raw_activity_type": "Ride",
    "raw_type": "Ride",
    "start_date_local": "2021-08-14T17:27:31Z",
    "type": "Ride",
    "year": 2021
  },
  {
    "date": "2021-08-19",
    "distance": 3488.1,
    "elevation_gain": 52.6,
    "id": "5819145369",
    "moving_time": 1080.0,
    "name": "Edinburgh run",
    "raw_activity_type": "Run",
    "raw_type": "Run",
    "start_date_local": "2021-08-19T17:32:18Z",
    "type": "Run",
    "year": 2021
  },
  {
    "date": "2021-08-25",
    "distance": 1722.9,
    "elevation_gain": 12.4,
    "id": "5851060107",
    "moving_time": 1510.0,
    "name": "Afternoon Walk",
    "raw_activity_type": "Walk",
    "raw_type": "Walk",
    "start_date_local": "2021-08-25T14:50:45Z",
    "type": "Walk",
    "year": 2021
  },
  {
    "date": "2021-08-25",
    "distance": 2677.5,
    "elevation_gain": 40.9,
    "id": "5852103216",
    "moving_time": 1227.0,
    "name": "Highland run with Lisa!",
    "raw_activity_type": "Run",
    "raw_type": "Run",
    "start_date_local": "2021-08-25T18:09:13Z",
    "type": "Run",
    "year": 2021
  },
  {
    "date": "2021-08-27",
    "distance": 3764.5,
    "elevation_gain": 6.9,
    "id": "5860976009",
    "moving_time": 1340.0,
    "name": "Roasting hot run",
    "raw_activity_type": "Run",
    "raw_type": "Run",
    "start_date_local": "2021-08-27T12:27:45Z",
    "type": "Run",
    "year": 2021
  },
  {
    "date": "2021-09-07",
    "distance": 28180.7,
    "elevation_gain": 272.0,
    "id": "5921248595",
    "moving_time": 3999.0,
    "name": "First one in a while!",
    "raw_activity_type": "Ride",
    "raw_type": "Ride",
    "start_date_local": "2021-09-07T14:56:03Z",
    "type": "Ride",
    "year": 2021
  },
  {
    "date": "2021-09-08",
    "distance": 27298.1,
    "elevation_gain": 297.0,
    "id": "5927653634",
    "moving_time": 3945.0,
    "name": "Extremely hot, extremely sweaty",
    "raw_activity_type": "Ride",
    "raw_type": "Ride",
    "start_date_local": "2021-09-08T17:01:22Z",
    "type": "Ride",
    "year": 2021
  },
  {
    "date": "2021-09-10",
    "distance": 8382.1,
    "elevation_gain": 0.0,
    "id": "5937780240",
    "moving_time": 1095.0,
    "name": "Ramp Test",
    "raw_activity_type": "Ride",
    "raw_type": "Ride",
    "start_date_local": "2021-09-10T16:57:32Z",
    "type": "Ride",
    "year": 2021
  },
  {
    "date": "2021-09-11",
    "distance": 60959.5,
    "elevation_gain": 781.0,
    "id": "5942445078",
    "moving_time": 9933.0,
    "name": "etape prep!",
    "raw_activity_type": "Ride",
    "raw_type": "Ride",
    "start_date_local": "2021-09-11T11:21:43Z",
    "type": "Ride",
    "year": 2021
  },
  {
    "date": "2021-09-13",
    "distance": 2903.2,
    "elevation_gain": 14.0,
    "id": "5952989322",
    "moving_time": 521.0,
    "name": "Hardware shop",
    "raw_activity_type": "Ride",
    "raw_type": "Ride",
    "start_date_local": "2021-09-13T12:07:11Z",
    "type": "Ride",
    "year": 2021
  },
  {
    "date": "2021-09-13",
    "distance": 17749.3,
    "elevation_gain": 0.0,
    "id": "5953618971",
    "moving_time": 2700.0,
    "name": "Sanford -1",
    "raw_activity_type": "Ride",
    "raw_type": "Ride",
    "start_date_local": "2021-09-13T14:11:20Z",
    "type": "Ride",
    "year": 2021
  },
  {
    "date": "2021-09-15",
    "distance": 11824.6,
    "elevation_gain": 0.0,
    "id": "5964825177",
    "moving_time": 1800.0,
    "name": "Black Giant -5",
    "raw_activity_type": "Ride",
    "raw_type": "Ride",
    "start_date_local": "2021-09-15T16:10:37Z",
    "type": "Ride",
    "year": 2021
  },
  {
    "date": "2021-09-15",
    "distance": 27094.7,
    "elevation_gain": 319.0,
    "id": "5965493944",
    "moving_time": 3869.0,
    "name": "Up to the dam",
    "raw_activity_type": "Ride",
    "raw_type": "Ride",
    "start_date_local": "2021-09-15T17:21:08Z",
    "type": "Ride",
    "year": 2021
  },
  {
    "date": "2021-09-17",
    "distance": 8054.3,
    "elevation_gain": 52.7,
    "id": "5974443819",
    "moving_time": 1660.0,
    "name": "Doing some chores",
    "raw_activity_type": "Ride",
    "raw_type": "Ride",
    "start_date_local": "2021-09-17T12:41:23Z",
    "type": "Ride",
    "year": 2021
  },
  {
    "date": "2021-09-19",
    "distance": 64223.5,
    "elevation_gain": 752.0,
    "id": "5984519811",
    "moving_time": 9397.0,
    "name": "Etape Caledonia",
    "raw_activity_type": "Ride",
    "raw_type": "Ride",
    "start_date_local": "2021-09-19T08:13:34Z",
    "type": "Ride",
    "year": 2021
  },
  {
    "date": "2021-09-20",
    "distance": 1345.9,
    "elevation_gain": 10.0,
    "id": "5990602108",
    "moving_time": 223.0,
    "name": "Fresh n fruity",
    "raw_activity_type": "Ride",
    "raw_type": "Ride",
    "start_date_local": "2021-09-20T14:28:52Z",
    "type": "Ride",
    "year": 2021
  },
  {
    "date": "2021-09-22",
    "distance": 23540.7,
    "elevation_gain": 282.0,
    "id": "6002661420",
    "moving_time": 3495.0,
    "name": "Dark, wet and windy. Winter is coming!",
    "raw_activity_type": "Ride",
    "raw_type": "Ride",
    "start_date_local": "2021-09-22T18:04:22Z",
    "type": "Ride",
    "year": 2021
  },
  {
    "date": "2021-09-23",
    "distance": 3480.3,
    "elevation_gain": 41.9,
    "id": "6006459639",
    "moving_time": 577.0,
    "name": "Errands",
    "raw_activity_type": "Ride",
    "raw_type": "Ride",
    "start_date_local": "2021-09-23T13:52:57Z",
    "type": "Ride",
    "year": 2021
  },
  {
    "date": "2021-09-23",
    "distance": 7390.3,
    "elevation_gain": 106.0,
    "id": "6007959920",
    "moving_time": 1216.0,
    "name": "At/Overs",
    "raw_activity_type": "VirtualRide",
    "raw_type": "VirtualRide",
    "start_date_local": "2021-09-23T19:13:10Z",
    "type": "VirtualRide",
    "year": 2021
  },
  {
    "date": "2021-09-29",
    "distance": 48253.6,
    "elevation_gain": 627.0,
    "id": "6038940010",
    "moving_time": 7125.0,
    "name": "Clunch road especial",
    "raw_activity_type": "Ride",
    "raw_type": "Ride",
    "start_date_local": "2021-09-29T16:24:48Z",
    "type": "Ride",
    "year": 2021
  },
  {
    "date": "2021-09-30",
    "distance": 17660.0,
    "elevation_gain": 179.0,
    "id": "6044342400",
    "moving_time": 2452.0,
    "name": "SST (Short)",
    "raw_activity_type": "VirtualRide",
    "raw_type": "VirtualRide",
    "start_date_local": "2021-09-30T19:56:17Z",
    "type": "VirtualRide",
    "year": 2021
  },
  {
    "date": "2021-10-02",
    "distance": 6485.1,
    "elevation_gain": 119.0,
    "id": "6054140231",
    "moving_time": 1212.0,
    "name": "Miracle",
    "raw_activity_type": "VirtualRide",
    "raw_type": "VirtualRide",
    "start_date_local": "2021-10-02T20:27:43Z",
    "type": "VirtualRide",
    "year": 2021
  },
  {
    "date": "2021-10-03",
    "distance": 58956.4,
    "elevation_gain": 700.0,
    "id": "6057437115",
    "moving_time": 9682.0,
    "name": "Accidental gravel ride; Or, Spine road is definitely not for road bikes",
    "raw_activity_type": "Ride",
    "raw_type": "Ride",
    "start_date_local": "2021-10-03T10:43:33Z",
    "type": "Ride",
    "year": 2021
  },
  {
    "date": "2021-10-06",
    "distance": 21291.4,
    "elevation_gain": 185.0,
    "id": "6073950134",
    "moving_time": 2836.0,
    "name": "THU: Tempo Torque",
    "raw_activity_type": "VirtualRide",
    "raw_type": "VirtualRide",
    "start_date_local": "2021-10-06T19:42:47Z",
    "type": "VirtualRide",
    "year": 2021
  },
  {
    "date": "2021-10-07",
    "distance": 7430.2,
    "elevation_gain": 87.0,
    "id": "6078867762",
    "moving_time": 1248.0,
    "name": "SAT or SUN: Race Day!",
    "raw_activity_type": "VirtualRide",
    "raw_type": "VirtualRide",
    "start_date_local": "2021-10-07T19:57:37Z",
    "type": "VirtualRide",
    "year": 2021
  },
  {
    "date": "2021-10-07",
    "distance": 11564.4,
    "elevation_gain": 48.0,
    "id": "6078975737",
    "moving_time": 1303.0,
    "name": "EVO CC Sprint Race Series  (D)",
    "raw_activity_type": "VirtualRide",
    "raw_type": "VirtualRide",
    "start_date_local": "2021-10-07T20:33:29Z",
    "type": "VirtualRide",
    "year": 2021
  },
  {
    "date": "2021-10-10",
    "distance": 32851.7,
    "elevation_gain": 524.0,
    "id": "6091194753",
    "moving_time": 5173.0,
    "name": "Renfrewshire roads",
    "raw_activity_type": "Ride",
    "raw_type": "Ride",
    "start_date_local": "2021-10-10T08:27:18Z",
    "type": "Ride",
    "year": 2021
  },
  {
    "date": "2021-10-11",
    "distance": 5152.4,
    "elevation_gain": 30.4,
    "id": "6098894835",
    "moving_time": 1779.0,
    "name": "Surprise 5k",
    "raw_activity_type": "Run",
    "raw_type": "Run",
    "start_date_local": "2021-10-11T20:04:36Z",
    "type": "Run",
    "year": 2021
  },
  {
    "date": "2021-10-14",
    "distance": 18356.5,
    "elevation_gain": 116.0,
    "id": "6113121846",
    "moving_time": 2631.0,
    "name": "TUE: Time Trial Ramp",
    "raw_activity_type": "VirtualRide",
    "raw_type": "VirtualRide",
    "start_date_local": "2021-10-14T18:27:48Z",
    "type": "VirtualRide",
    "year": 2021
  },
  {
    "date": "2021-10-17",
    "distance": 20525.8,
    "elevation_gain": 204.0,
    "id": "6128258015",
    "moving_time": 3193.0,
    "name": "THU: Climbing Adaption",
    "raw_activity_type": "VirtualRide",
    "raw_type": "VirtualRide",
    "start_date_local": "2021-10-17T18:04:54Z",
    "type": "VirtualRide",
    "year": 2021
  },
  {
    "date": "2021-10-18",
    "distance": 2598.6,
    "elevation_gain": 17.9,
    "id": "6132116703",
